id	text	event1	event2	event3	event4	event5	event6	event7	event8
NLD100130	C. Where reasonably necessary, vulnerable young people (13-18) among themselves and vulnerable young people with youth professionals may deviate from the 1.5 meter measure in youth aid.	False	False	False	False	False	False	False	False	False
NLD100131	This includes activities in the context of daytime activities, day care, day treatment and special secondary education including transport.	False	False	False	False	False	False	False	False	False
NLD100132	Food and beverage outlets	False	False	False	False	False	False	False	False	False
NLD100133	By way of derogation from part II, part 1 of the designation of 24 April 2020, food and beverage outlets, including terraces, may reopen to guests from 1 June from 12:00 noon under certain conditions.	False	False	False	False	False	False	False	False	False
NLD100134	Dance venues remain closed.	False	False	False	False	False	False	False	False	False
NLD100135	A food and drink facility that also has a dance floor may remain open, provided the dance floor is closed.	False	False	False	False	False	False	False	False	False
NLD100136	A maximum of 30 guests per building may be present in the indoor area of food and beverage outlets.	False	False	False	False	False	False	False	False	False
NLD100137	Within these venues, those present must keep 1.5 meters away, with the exception of persons who form a joint household.	False	False	False	False	False	False	False	False	False
NLD100138	The 1.5 m is maintained from 3 people.	False	False	False	False	False	False	False	False	False
NLD100139	All guests must use a seat at a table or bar.	False	False	False	False	False	False	False	False	False
NLD100140	Guests must book in advance.	False	False	False	False	False	False	False	False	False
NLD100141	Guests must book in advance.	False	False	False	False	False	False	False	False	False
NLD100142	The operator or manager is primarily responsible for compliance with the 1.5 meter and other regulations, as well as for checking them.	False	False	False	False	False	False	False	False	False
NLD100143	Para-commercial food and beverage outlets that are part of outdoor sports facilities (club canteens) will remain closed.	False	False	False	False	False	False	False	False	False
NLD100144	Commercial catering establishments near or on sports facilities may be open to guests under the above conditions.	False	False	False	False	False	False	False	False	False
NLD100145	Outdoor terraces may be open provided that guests have a seat at a table and are kept five feet away, with the exception of persons who form a common household.	False	False	False	False	False	False	False	False	False
NLD100146	The 1.5 m is maintained for 3 people.	False	False	False	False	False	False	False	False	False
NLD100147	The terraces must be completely open at the top or completely open on all three sides.	False	False	False	False	False	False	False	False	False
NLD100148	The operator or manager is primarily responsible for compliance with the 1.5 meters and the other regulations, as well as for checking them.	False	False	False	False	False	False	False	False	False
NLD100149	The same rules apply to terraces in covered shopping centers as to the indoor areas of food and beverage outlets.	False	False	False	False	False	False	False	False	False
NLD100150	The operator or manager must arrange the terrace in such a way that guests and staff can always keep a distance of one and a half meters from each other.	False	False	False	False	False	False	False	False	False
NLD100151	In the case of adjacent terraces, the managers of these terraces jointly ensure that one and a half meters are observed.	False	False	False	False	False	False	False	False	False
NLD100152	From operators or Terrace managers are expected to regulate the influx on the terrace and also prevent clustering of waiting or departing guests outside the terrace.	False	False	False	False	False	False	False	False	False
NLD100153	Food and beverage outlets that are part of establishments that are still closed will remain closed, unless this instruction dictates otherwise.	False	False	False	False	False	False	False	False	False
NLD100154	The chairman of the security region ensures that municipalities draw up an area approach for catering concentration areas to prevent great crowds and influx in these areas.	False	False	False	False	False	False	False	False	False
NLD100155	Cinemas and cultural institutions.	False	False	False	False	False	False	False	False	False
NLD100156	By way of derogation from part I, parts 1 and 2, of the designation of 24 April 2020, cinemas, cinemas, concert halls, stages for all genres of music, theaters and similar cultural institutions may organize activities aimed at the public from 1 June at 12:00 noon.	False	False	False	False	False	False	False	False	False
NLD100157	A maximum of 30 visitors may be present at the same time per individual room within these institutions.	False	False	False	False	False	False	False	False	False
NLD100158	A visibly separated stage is considered a separate space.	False	False	False	False	False	False	False	False	False
NLD100159	All those present must keep a distance of 1.5 meters from each other, with the exception of persons who form a joint household.	False	False	False	False	False	False	False	False	False
NLD100160	Visitors must book in advance.	False	False	False	False	False	False	False	False	False
NLD100161	Museums, presentation institutions and monuments.	False	False	False	False	False	False	False	False	False
NLD100162	Museums, presentation institutions and monuments with a public function may also reopen to visitors from 1 June, 12 noon.	False	False	False	False	False	False	False	False	False
NLD100163	Visitors must book in advance per time slot.	False	False	False	False	False	False	False	False	False
NLD100164	The institutions must organize the admission and residence times and the layout of the institution in such a way that visitors can always keep 1.5 meters away, with the exception of persons who form a joint household.	False	False	False	False	False	False	False	False	False
NLD100165	The provision in II, part 4 of the designation of 24 April will read as follows:	False	False	False	False	False	False	False	False	False
NLD100166	4. As of 1 June, travelers from the age of 13 must wear a non-medical mouth nose mask on public transport.	False	False	False	False	False	False	False	False	False
NLD100167	In practice, enforcement takes place by the transporters designated as supervisors and other supervisors designated under the 2000 Passenger Transport Act.	False	False	False	False	False	False	False	False	False
NLD100168	Termination or limitation of facilities for public transport, in consultation with the transporter, if they do not or insufficiently adhere to the realization of the restrictive measures with regard to wearing a mouth nose mask and keeping a distance of 1.5 meters as much as possible between all persons present in the facility, or to make them sufficiently visible, provided that the termination of this facility does not unnecessarily impede the transport of persons working in vital processes or transport that is otherwise necessary for the mobility of the Netherlands.	False	False	False	False	False	False	False	False	False
NLD100169	The ban on offering educational activities in educational institutions will be lifted for secondary education from 2 June.	False	False	False	False	False	False	False	False	False
NLD100170	Education will be restarted step by step.	False	False	False	False	False	False	False	False	False
NLD100171	Schools for special secondary education and others can open completely again.	False	False	False	False	False	False	False	False	False
NLD100172	The aforementioned educational institutions must take careful measures to limit the risk of contamination, including keeping a distance of 1.5 meters between all persons present in these institutions (as much as possible for secondary special education in special circumstances.	False	False	False	False	False	False	False	False	False
NLD100173	In addition they should ask students to avoid public transport.	False	False	False	False	False	False	False	False	False
NLD100174	Primary education will be fully resumed from 8 June, unless it appears before the spread of the virus is not justified.	False	False	False	False	False	False	False	False	False
NLD100175	The partial ban on opening child and out-of-school care will also lapse.	False	False	False	False	False	False	False	False	False
NLD100176	The prohibition on offering educational activities in educational institutions in secondary vocational education and higher education will be lifted as of 15 June for holding exams, exams, tests, practical (specific) education and supervision of vulnerable students at the educational institution, insofar as this is online. Cannot be sufficient.	False	False	False	False	False	False	False	False	False
NLD100177	A condition for this is that the institutions take careful measures to limit the risk of contamination, including keeping a distance of 1.5 meters between all persons present in these institutions and that students are asked to avoid public transport as much as possible.	False	False	False	False	False	False	False	False	False
NLD100178	The institutions must make agreements with relevant parties about mobility and the use of public transport.	False	False	False	False	False	False	False	False	False