id	text	event1	event2	event3	event4	event5	event6	event7	event8
nan	2 Het verbod, bedoeld in het eerste lid, geldt voor het luchtverkeer afkomstig uit de volgende landen die een hoog-risico vormen bij de verspreiding van het virus dat COVID-19 veroorzaakt:b. China;	nan	nan	nan	nan	nan	nan	nan	nan
nan	Gasten dienen vooraf te reserveren.	nan	nan	nan	nan	nan	nan	nan	nan
nan	- uitvaarten en huwelijksvoltrekkingen mits daarbij niet meer dan 30 personen aanwezig zijn;	nan	nan	nan	nan	nan	nan	nan	nan
nan	In de opvolging van deze opdracht heeft u de mogelijkheid om deze locaties te sluiten of gesloten te houden indien u van oordeel bent dat de maatregel om 1,5 meter afstand te houden (naar verwachting) niet goed wordt nageleefd of niet goed na te leven is of dat u problemen verwacht dan wel constateert met het gebruik van het mobiliteitssysteem en in het bijzonder het openbaar vervoer.	nan	nan	nan	nan	nan	nan	nan	nan
nan	Het verbod op het uitoefenen van het contactberoep geldt nog wel voor sekswer kers, zij mogen hun beroep nog niet uitoefenen.	nan	nan	nan	nan	nan	nan	nan	nan
nan	- Buiten sporten en bewegen voor personen van 19 jaar en ouder is toegestaan, onder andere in teamverband. Voor deze leeftijdsgroep geldt, net  als bij de leeftijdsgroepen tot 19 jaar, dat zij geen wedstrijden mogen organiseren, niet aan wedstrijden mogen deelnemen en rondom het sporten en bewegen geen gebruik mogen maken van gemeenschappelijke was- en douchevoorzieningen.	nan	nan	nan	nan	nan	nan	nan	nan
nan	Bibliotheken, pretparken en dierentuinen	nan	nan	nan	nan	nan	nan	nan	nan
nan	- de organisatie van toetsing en examens, mits zorgvuldige maatregelen zijn getroffen om het risico van besmetting te beperken.	nan	nan	nan	nan	nan	nan	nan	nan
nan	Het verbod op het bieden van onderwijsactiviteiten in onderwijsinstellingen wordt, voor het voortgezet onderwijs, opgeheven vanaf 2 juni.	nan	nan	nan	nan	nan	nan	nan	nan
nan	Op 24 april en 8 mei heb ik u opdracht gegeven om uw bevoegdheden op het terrein van publieke gezondheid en openbare orde en veiligheid in te zetten om verschillende maatregelen te nemen die nodig zijn voor de bestrijding van COVID_x0002_19.	nan	nan	nan	nan	nan	nan	nan	nan
nan	De exploitant of beheerder is primair verantwoordelijk voor de naleving van de 1,5 meter en de overige voorschriften als ook de controle daarop.	nan	nan	nan	nan	nan	nan	nan	nan
nan	Voorwaarde hiervoor is dat de instellingen zorgvuldige maatregelen nemen om het risico op besmetting te beperken waaronder het houden van 1,5 meter afstand tussen alle in deze instellingen aanwezige personen en dat van studenten wordt gevraagd het openbaar vervoer zoveel mogelijk te mijden.	nan	nan	nan	nan	nan	nan	nan	nan
nan	b. repatriëring van EU- of Schengeningezetenen en ingezetenen uit het Verenigd Koninkrijk, waarbij:	nan	nan	nan	nan	nan	nan	nan	nan
nan	Voor de onder 4 tot en met 7 genoemde maatregelen kunt u een voorziening in de noodverordening te treffen, opdat optreden krachtens die verordening mogelijk is indien dat noodzakelijk is.	nan	nan	nan	nan	nan	nan	nan	nan
nan	Hierbij gaat het om o.a. activiteiten in het kader van dagbesteding, dagopvang, dagbehandeling en voortgezet speciaal onderwijs inclusief vervoer.	nan	nan	nan	nan	nan	nan	nan	nan
nan	III. Bepalingen voor onderwijsinstellingen en verblijven voor kinderopvang, buitenschoolse opvang en gastouderopvang	nan	nan	nan	nan	nan	nan	nan	nan
nan	- wettelijk verplichte samenkomsten, zoals vergaderingen van gemeenteraden, mits daarbij niet meer dan 100 personen aanwezig zijn, alsook vergaderingen van de Staten-Generaal;	nan	nan	nan	nan	nan	nan	nan	nan
nan	De beheerders van de zwemgelegenheden zijn ervoor verantwoordelijk dat de maatregel om 1,5 meter afstand te houden goed wordt nageleefd in en om de zwemgelegenheden.	nan	nan	nan	nan	nan	nan	nan	nan
nan	Basisonderwijs	nan	nan	nan	nan	nan	nan	nan	nan
nan	3. Sluiten van casino's, speelhallen en daarmee vergelijkbare instellingen, alsook  sluiten van zaken waarbinnen op de uiterlijke verzorging gerichte contactberoepen worden uitgeoefend, zoals kapperszaken en nagelsalons.	nan	nan	nan	nan	nan	nan	nan	nan
nan	2 Het verbod, bedoeld in het eerste lid, geldt voor het luchtverkeer afkomstig uit de volgende landen die een hoog-risico vormen bij de verspreiding van het virus dat COVID-19 veroorzaakt:f. Oostenrijk.	nan	nan	nan	nan	nan	nan	nan	nan
nan	Onder groepsvorming wordt hierbij verstaan: drie of meer personen die daarbij niet of niet in voldoende mate een onderlinge af stand van 1,5 meter in acht nemen.	nan	nan	nan	nan	nan	nan	nan	nan
nan	b) als het de afstand tot kinderen tot en met 12 jaar betreft, of	nan	nan	nan	nan	nan	nan	nan	nan
nan	Verder geef ik u opdracht om de mogelijkheid om winkels en markten uit te zon deren van het verbod op samenkomsten, uit te breiden met bibliotheken, pretpar ken en dierentuinen, mits bezoekers en werknemers te allen tijde 1,5 meter af stand houden tot de dichtstbijzijnde persoon.	nan	nan	nan	nan	nan	nan	nan	nan
nan	Verder geef ik u de opdracht het verbod op de organisatie van alle evenementen en bijeenkomsten met meer dan 100 personen in uw regio te verlengen tot en met 6 april 2020.	nan	nan	nan	nan	nan	nan	nan	nan
nan	Voor de handhaving kunt u eventueel ook gebruik maken van artikel 47 van de Wet publieke gezondheid.	nan	nan	nan	nan	nan	nan	nan	nan
nan	De opdracht inzake het verbod voor evenementen wordt verlengd tot 1 september 2020.	nan	nan	nan	nan	nan	nan	nan	nan
nan	a. vluchten als bedoeld in het eerste lid, die op het tijdstip van inwerkingtreding reeds zijn aangevangen;	nan	nan	nan	nan	nan	nan	nan	nan
nan	De beoefenaren van contactberoepen en de beheerders van inrichtingen waar contactberoepen worden uitgeoefend zijn verantwoordelijk voor het regelen en organiseren van de maatregelen die nodig zijn om het werk op een zorgvuldige manier te doen.	nan	nan	nan	nan	nan	nan	nan	nan
nan	Daarnaast is van groepsvorming geen sprake als het kinderen tot en met 12 jaar betreft die samen spelen onder toezicht van een of meer ouders of voogden die daarbij onderling een afstand van 1,5 meter in acht nemen.	nan	nan	nan	nan	nan	nan	nan	nan
nan	Ik geef u opdracht om, aanvullend op de eerdere opdracht, vanaf 15 maart 2020, 18:00u ook te zorgen voor sluiting van alle eet- en drinkgelegenheden, sport- en fitnessclubs, sauna's, seksinrichtingen en coffeeshops.	nan	nan	nan	nan	nan	nan	nan	nan
nan	Het onderwijs wordt stapsgewijs weer opgestart.	nan	nan	nan	nan	nan	nan	nan	nan
nan	Het gedeeltelijk verbod op de openstelling van kinder- en buitenschoolse opvang komt eveneens te vervallen.	nan	nan	nan	nan	nan	nan	nan	nan
nan	- de (nood)opvang van kinderen van ouders die werken in cruciale beroepen of voor vitale processen, zoals beschreven op www.rijksoverheid.nl. De noodopvang wordt georganiseerd door gemeenten, ondersteund door de Vereniging  Nederlandse Gemeenten;	nan	nan	nan	nan	nan	nan	nan	nan
nan	Ik geef u de opdracht om de sluiting van zwemgelegenheden te beëindigen, maar wel de mogelijkheid te houden om deze locaties te sluiten of gesloten te houden indien u van oordeel bent dat de maatregel om 1,5 meter afstand te houden niet goed wordt nageleefd.	nan	nan	nan	nan	nan	nan	nan	nan
nan	2 Het verbod, bedoeld in het eerste lid, geldt voor het luchtverkeer afkomstig uit de volgende landen die een hoog-risico vormen bij de verspreiding van het virus dat COVID-19 veroorzaakt:	nan	nan	nan	nan	nan	nan	nan	nan
nan	De onder 2 en 3 bedoelde verboden dient u op te nemen in een noodverordening.	nan	nan	nan	nan	nan	nan	nan	nan
nan	Scholen voor voortgezet speciaal onderwijs c.a. kunnen weer geheel open.	nan	nan	nan	nan	nan	nan	nan	nan
nan	Een eet- en drinkgelegenheid waar ook een dansvloer is, mag openblijven mits de dansvloer is gesloten.	nan	nan	nan	nan	nan	nan	nan	nan
nan	2. Het verbod, bedoeld in het eerste lid, geldt voor het luchtverkeer afkomstig uit de volgende landen die een hoog-risico vormen bij de verspreiding van het virus dat COVID-19 veroorzaakt:a. Italië;	nan	nan	nan	nan	nan	nan	nan	nan
nan	De sluiting van sanitaire voorzieningen geldt in deze locaties alleen voor gemeenschappelijke was- en douchegelegenhe den.	nan	nan	nan	nan	nan	nan	nan	nan
nan	Dat geldt  ook voor publieke locaties, zoals musea, concertzalen, theaters en sportclubs en  sportwedstrijden.	nan	nan	nan	nan	nan	nan	nan	nan
nan	Binnen deze gelegenheden moeten de aanwezigen 1,5 meter afstand houden, met uitzondering van personen die een gezamenlijk huishouden vormen.	nan	nan	nan	nan	nan	nan	nan	nan
nan	Dit betekent dat het vanaf 11 mei ook mogelijk wordt om in overdekte zwemgelegenheden te sporten en bewegen.	nan	nan	nan	nan	nan	nan	nan	nan
nan	Hierbij moeten door de genoemde onderwijsinstellingen zorgvuldige maatregelen genomen worden om het risico van besmetting te beperken, waaronder 1,5 meter afstand houden tussen alle aanwezige personen in deze instellingen (voor het voortgezet speciaal onderwijs in bijzondere omstandigheden zo veel als mogelijk.	nan	nan	nan	nan	nan	nan	nan	nan
nan	Covid-19: ziekte veroorzaakt door het SARS-CoV-2 virus.	nan	nan	nan	nan	nan	nan	nan	nan
nan	Zwemgelegenheden en sportclubs	nan	nan	nan	nan	nan	nan	nan	nan
nan	De nieuwe opdracht betreft de periode vanaf 29 april tot en met 19 mei 2020.	nan	nan	nan	nan	nan	nan	nan	nan
nan	De exploitant of beheerder dient het terras zo in te richten dat gasten en personeel altijd anderhalve meter afstand kunnen houden tot elkaar.	nan	nan	nan	nan	nan	nan	nan	nan
nan	Bezoekers moeten vooraf reserveren.	nan	nan	nan	nan	nan	nan	nan	nan
nan	Gelet op artikel 21 van Verordening (EG) Nr. 1008/2008 van het Europees Parlement en de Raad van 24 september 2008 inzake gemeenschappelijke regels voor de exploitatie van luchtdiensten in de Gemeenschap (PbEU 2008, L 293) en artikel 5.10, eerste lid, onderdeel a, van de Wet luchtvaart;	nan	nan	nan	nan	nan	nan	nan	nan
nan	Voor terrassen in overdekte winkelcentra gelden dezelfde regels als voor de binnenruimten van eet- en drinkgelegenheden.	nan	nan	nan	nan	nan	nan	nan	nan
nan	3 Het verbod, bedoeld in het eerste lid, geldt niet voor:	nan	nan	nan	nan	nan	nan	nan	nan
nan	Handhaving vindt in de praktijk plaats door de vervoerders als toezichthouders aangewezen personen en andere op grond van de Wet Personenvervoer 2000 aangewezen toezichthouders.	nan	nan	nan	nan	nan	nan	nan	nan
nan	Naast deze aanwijzing heb ik op 17 april voor vijf veiligheidsregio's met een luchthaven een afzonderlijke aanwijzing gegeven.	nan	nan	nan	nan	nan	nan	nan	nan
nan	Het toestaan van de uitoefening van contactberoepen betekent dat ook de inrichtingen waar de op de uiterlijke verzorging gerichte contactberoepen worden uitgeoefend weer volledig openge steld en benut kunnen worden.	nan	nan	nan	nan	nan	nan	nan	nan
nan	Dansgelegenheden blijven gesloten.	nan	nan	nan	nan	nan	nan	nan	nan
nan	Verder geef ik u opdracht om een uitzondering te maken op de sluiting van inrichtingen voor sporten en bewegen voor zover dat nodig is om buiten sporten voor personen van 19 jaar en ouder mogelijk te maken.	nan	nan	nan	nan	nan	nan	nan	nan
nan	Ook voor structurele vrijwilligers is een uitzondering mogelijk.	nan	nan	nan	nan	nan	nan	nan	nan
nan	Ik geef u nu opdracht om enkele maatregelen met ingang van 1 juni 2020, 12.00 uur en, voor zover het middelbaar beroepsonderwijs en hoger onderwijs betreft, 15 juni 2020, aan te passen.	nan	nan	nan	nan	nan	nan	nan	nan
nan	4. Verbod op het uitoefenen van alle vormen van contactberoepen, waaronder masseurs, kappers, nagelstylisten, escortservices en rij-instructeurs, voor zover deze beroepen niet naar behoren met inachtneming van 1,5 meter afstand tot de klant kunnen worden uitgeoefend. Uitgezonderd is de uitoefening van (para)medische beroepen, mits voor deze uitoefening een individuele medische indicatie be staat en daarbij door de beoefenaar alle in verband met COVID-19 benodigde hy giënevereisten in acht worden genomen.	nan	nan	nan	nan	nan	nan	nan	nan
nan	Voor zwemgelegenheden geldt dat ge meenschappelijke was- en douchegelegenheden niet gebruikt kunnen worden.	nan	nan	nan	nan	nan	nan	nan	nan
nan	De instellingen dienen met relevante partijen afspraken te maken over mobiliteit en het gebruik van het openbaar vervoer.	nan	nan	nan	nan	nan	nan	nan	nan
nan	Beëindigen of beperken van voorzieningen voor openbaar vervoer, in overleg met de vervoerder, indien deze zich niet of onvoldoende mate houden aan de verwezenlijking van de beperkende maatregelen met betrekking tot het dragen van een mondneuskapje en het zo veel mogelijk houden van 1,5 meter afstand tussen alle in de voorziening aanwezige personen, of aan het op adequate wijze zichtbaar duidelijk maken daarvan, mits de beëindiging van deze voorziening het transport van personen die werkzaam zijn in vitale processen of transport dat anderszins noodzakelijk is voor de mobiliteit van Nederland niet onnodig belemmert.	nan	nan	nan	nan	nan	nan	nan	nan
nan	In de opvolging van deze opdracht heeft u de mogelijkheid om deze locaties te sluiten of gesloten te houden indien u van oordeel bent dat de maatregel om 1,5 meter afstand te houden (naar verwachting) niet goed wordt nageleefd of niet goed na te leven is of dat u problemen verwacht dan wel constateert met het ge bruik van het mobiliteitssysteem en in het bijzonder het openbaar vervoer.	nan	nan	nan	nan	nan	nan	nan	nan
nan	1. Verbod voor alle vergunningsplichtige en meldplichtige evenementen tot 1 juni  2020.	nan	nan	nan	nan	nan	nan	nan	nan
nan	Ik hou er rekening mee dat deze maatregel na 6 april 2020 verlengd zal worden.	nan	nan	nan	nan	nan	nan	nan	nan
nan	Musea, presentatie-instellingen en monumenten.	nan	nan	nan	nan	nan	nan	nan	nan
nan	BESLUIT:	nan	nan	nan	nan	nan	nan	nan	nan
nan	1° niet-Nederlands ingezetenen een aantoonbare doorreis hebben,	nan	nan	nan	nan	nan	nan	nan	nan
nan	Gehoord hebbende het advies van het Outbreak Management Team en het Bestuurlijk Afstemmingsoverleg van 18 maart 2020 en een advies van Verenso (Vereniging van specialisten ouderengeneeskunde) heeft de Ministeriële Commissie Crisisbeheersing van 19 maart 2020, in aanwezigheid van een vertegenwoordigervan de voorzitters veiligheidsregio's, besloten dat vanaf 20 maart 2020 tot en met 6 april 2020 alle verpleeghuizen en kleinschalige woonvormen in de ouderenzorg preventief worden gesloten voor bezoek en voor alle anderen die niet noodzakelijk zijn voor de basiszorg.	nan	nan	nan	nan	nan	nan	nan	nan
nan	Voor winkels, markten, bibliotheken, pretparken, dierentuinen, musea en presentatie-instellingen kan een uitzondering worden gemaakt van het verbod op samenkomsten mits bezoekers en werknemers te allen tijde 1,5 meter afstand houden tot de dichtstbijzijnde persoon.	nan	nan	nan	nan	nan	nan	nan	nan
nan	Alle zwemgelegenheden kunnen vanaf 11 mei opengesteld worden.	nan	nan	nan	nan	nan	nan	nan	nan
nan	a) die een gezamenlijk huishouden vormen,	nan	nan	nan	nan	nan	nan	nan	nan
nan	De volgende uitzonderingen op dit verbod op samenkomsten gelden, mits betrokkenen te allen tijde 1,5 meter afstand houden tot de dichtstbijzijnde  persoon:	nan	nan	nan	nan	nan	nan	nan	nan
nan	De locaties kunnen, en moeten waar nodig, wel gebruikt worden voor:	nan	nan	nan	nan	nan	nan	nan	nan
nan	De in de voetnoot genoemde aanwijzingen) zijn met ingang van 29 april 2020 niet meer van toepassing.	nan	nan	nan	nan	nan	nan	nan	nan
nan	Eet- en drinkgelegenheden	nan	nan	nan	nan	nan	nan	nan	nan
nan	Vanaf 8 juni wordt, het basisonderwijs volledig hervat, tenzij hiervoor blijkt dat dit i.v.m. de verspreiding van het virus niet verantwoord is.	nan	nan	nan	nan	nan	nan	nan	nan
nan	3. Er is een verbod op het in de publieke ruimte (incl. vaartuigen en voertuigen) niet in acht nemen van een onderlinge afstand van 1,5 meter.	nan	nan	nan	nan	nan	nan	nan	nan
nan	Uiterlijk in de week van 12 mei 2020 zal een heroverweging plaatsvinden van de maatregelen die gelden tot en met 19 mei.	nan	nan	nan	nan	nan	nan	nan	nan
nan	Alle gasten moeten gebruik maken van een zitplaats aan een tafel of bar.	nan	nan	nan	nan	nan	nan	nan	nan
nan	Toiletten kunnen wel gebruikt worden.	nan	nan	nan	nan	nan	nan	nan	nan
nan	c) indien het een persoon betreft met een handicap en diens begeleiders.	nan	nan	nan	nan	nan	nan	nan	nan
nan	Als u constateert dat onderwijsinstellingen of aanbieders van kinderopvang of  gastouderopvang zich niet aan deze crisismaatregel houden en er aanhoudend  meer leerlingen, studenten of kinderen aanwezig zijn op een locatie dan nodig is voor de bovengenoemde doelen, geef ik u opdracht op basis van artikel 7 van de Wet publieke gezondheid en met inachtneming van artikel 39, eerste lid, van de Wet veiligheidsregio's, de onderwijsinstelling of het verblijf voor kinderopvang of gastouderopvang te sluiten, bijvoorbeeld met behulp van een noodbevel.	nan	nan	nan	nan	nan	nan	nan	nan
nan	7. Instellen van een verbod op al dan niet toevallige groepsvorming in (bepaalde delen van) de publieke ruimte.	nan	nan	nan	nan	nan	nan	nan	nan
nan	Uitgezonderd van deze opdracht zijn hotels, thuisbezorgde maaltijden en catering.	nan	nan	nan	nan	nan	nan	nan	nan
nan	Bezoekers dienen vooraf per tijdvak te reserveren.	nan	nan	nan	nan	nan	nan	nan	nan
nan	Van exploitanten of beheerders van een terras wordt verwacht dat zij zorg dragen voor het reguleren van de toestroom op het terras en daarbij ook clustering van wachtende of vertrekkende gasten buiten het terras voorkomen.	nan	nan	nan	nan	nan	nan	nan	nan
nan	Artikel 2. (Verbod uitoefening burgerluchtverkeer)	nan	nan	nan	nan	nan	nan	nan	nan
nan	In deze opdracht heb ik de eerdere aanwijzingen die ik aan alle voorzitters van de veiligheidsregio heb verstrekt, verwerkt en aangepast.	nan	nan	nan	nan	nan	nan	nan	nan
nan	De opdracht inzake het verbod voor evenementen blijft, voor alle duidelijkheid, gelden tot 1 juni 2020.	nan	nan	nan	nan	nan	nan	nan	nan
nan	In afwijking van deel II, onderdeel 1 van de aanwijzing van 24 april 2020 mogen  eet- en drinkgelegenheden, met inbegrip van terrassen per 1 juni vanaf 12.00 uur onder voorwaarden weer open voor gasten.	nan	nan	nan	nan	nan	nan	nan	nan
nan	5. Sluiten van winkels en markten, of beëindigen van openbaar vervoer, indien deze voorzieningen zich niet of niet in voldoende mate houden aan de verwezenlijking van de beperkende maatregelen met betrekking tot het houden van 1,5 meter afstand tussen alle in de voorziening aanwezige personen, of aan het op adequate wijze zichtbaar duidelijk maken daarvan.	nan	nan	nan	nan	nan	nan	nan	nan
nan	Commerciële horecagelegenheden bij of op sportaccommodaties mogen onder bovengenoemde voorwaarden wel open voor gasten.	nan	nan	nan	nan	nan	nan	nan	nan
nan	2° passagiers uitsluitend overeenkomstig WHO-richtsnoeren en de EU Healthy Gateways, No. 801493, aan boord worden toegelaten;	nan	nan	nan	nan	nan	nan	nan	nan
nan	1,5-meternorm en samenkomsten	nan	nan	nan	nan	nan	nan	nan	nan
nan	Op basis van artikel 7 van de Wet publieke gezondheid en met inachtneming van artikel 39, eerste lid, van de Wet veiligheidsregio's, geef ik u daarom opdracht om uw bevoegdheden op het terrein van openbare orde en veiligheid in te zetten als verpleeghuizen of kleinschalige woonvormen, ondanks nadrukkelijke inspanningen van hun kant, problemen ervaren met het weigeren van bezoekers of derden die de locatie proberen binnen te komen.	nan	nan	nan	nan	nan	nan	nan	nan
nan	6. Sluiten van alle vormen van locaties, waaronder vakantieparken, campings, parken, natuurgebieden en stranden, indien op deze locaties niet of niet in vol doende mate de beperkende maatregel met betrekking tot het houden van 1,5 meter afstand tussen daar aanwezige personen in acht wordt genomen of het niet in acht nemen daarvan dreigt.	nan	nan	nan	nan	nan	nan	nan	nan
nan	Ik geef u opdracht om alle evenementen met meer dan 100 personen in uw regio in de periode van 13 maart tot en met 31 maart 2020 af te gelasten.	nan	nan	nan	nan	nan	nan	nan	nan
nan	De bepaling in II, onderdeel 4 van de aanwijzing van 24 april komt als volgt te luiden:	nan	nan	nan	nan	nan	nan	nan	nan
nan	In de week van 1 juni 2020 besluit het kabinet opnieuw over het verlengen en/of aanpassen van maatregelen.	nan	nan	nan	nan	nan	nan	nan	nan
nan	Dit verbod geldt niet indien het personen betreft	nan	nan	nan	nan	nan	nan	nan	nan
nan	A. Deel I, onderdeel 3, van de aanwijzing van 24 april 2020 komt als volgt te luiden:	nan	nan	nan	nan	nan	nan	nan	nan
nan	De maatregelen worden hieronder in de volgende bijlagen beschreven:	nan	nan	nan	nan	nan	nan	nan	nan
nan	Bij aanpalende terrassen zorgen de beheerders van deze terrassen gezamenlijk voor het in acht kunnen nemen van de anderhalve meter.	nan	nan	nan	nan	nan	nan	nan	nan
nan	Hierbij geldt dat de 1,5 m gehandhaafd wordt vanaf 3 personen.	nan	nan	nan	nan	nan	nan	nan	nan
nan	Uiteraard moeten betrokkenen te allen tijde 1,5 meter afstand houden tot de dichtstbijzijnde persoon.	nan	nan	nan	nan	nan	nan	nan	nan
nan	Eet- en drinkgelegenheden die onderdeel zijn van inrichtingen die nog zijn gesloten, blijven gesloten, tenzij uit deze aanwijzing anders voortvloeit.	nan	nan	nan	nan	nan	nan	nan	nan
nan	Van groepsvorming is geen sprake indien het personen betreft die een gezamenlijk huishouden vormen.	nan	nan	nan	nan	nan	nan	nan	nan
nan	c. het vervoer van medisch personeel of patiënten wanneer dit in het belang is van de volksgezondheid.	nan	nan	nan	nan	nan	nan	nan	nan
nan	- uitvaarten en huwelijksvoltrekkingen mits daarbij niet meer dan 30 personen aanwezig zijn;	nan	nan	nan	nan	nan	nan	nan	nan
nan	Gasten dienen vooraf te reserveren.	nan	nan	nan	nan	nan	nan	nan	nan
nan	Voortgezet onderwijs	nan	nan	nan	nan	nan	nan	nan	nan
nan	II. Bepalingen voor bedrijven en locaties, contactberoepen en voorzieningen voor openbaar vervoer	nan	nan	nan	nan	nan	nan	nan	nan
nan	In de stervensfase of vergelijkbare omstandigheden kan een instelling incidenteel afwijken van deze maatregel.	nan	nan	nan	nan	nan	nan	nan	nan
nan	4. In het openbaar vervoer is per 1 juni voor reizigers vanaf 13 jaar het dragen van een niet-medisch mondneuskapje verplicht.	nan	nan	nan	nan	nan	nan	nan	nan
nan	2. Verbod voor alle overige samenkomsten, waarbij uitzonderingen gelden voor de volgende samenkomsten, mits betrokkenen te allen tijde 1,5 meter afstand houden tot de dichtstbijzijnde persoon:	nan	nan	nan	nan	nan	nan	nan	nan
nan	De beheerders van deze locaties zijn ervoor verantwoordelijk plannen te maken waarmee ze er onder andere voor zor gen dat de 1,5 meter afstand bewaard blijft en de belasting voor het mobiliteits systeem en in het bijzonder het openbaar vervoer acceptabel blijft.	nan	nan	nan	nan	nan	nan	nan	nan
nan	Buiten sporten en bewegen	nan	nan	nan	nan	nan	nan	nan	nan
nan	Buitenterrassen mogen open op voorwaarde dat de gasten een zitplaats aan een tafel hebben en anderhalve meter afstand houden, met uitzondering van personen die een gezamenlijk huishouden vormen.	nan	nan	nan	nan	nan	nan	nan	nan
nan	Artikel 1. (begripsomschrijving)    In deze regeling wordt verstaan onder:	nan	nan	nan	nan	nan	nan	nan	nan
nan	De eerdere uitzonderingen voor georganiseerd buiten sporten en bewegen voor kinderen tot en met 18 jaar omvatten overigens mede, onder dezelfde voorwaar den (georganiseerd, buiten, 13 tot en met 18 jaar afstand houden), activiteiten van scouting-, cultuur-, kunst-, en andere jeugdverenigingen.	nan	nan	nan	nan	nan	nan	nan	nan
nan	2 Het verbod, bedoeld in het eerste lid, geldt voor het luchtverkeer afkomstig uit de volgende landen die een hoog-risico vormen bij de verspreiding van het virus dat COVID-19 veroorzaakt:d. Zuid-Korea;	nan	nan	nan	nan	nan	nan	nan	nan
nan	B Het verbod op samenkomsten in de aanwijzing van 24 april, deel I onderdeel 2, komt als volgt te luiden:2. Samenkomsten van meer dan dertig personen, exclusief personeel, in voor publiek openstaande gebouwen en daarbij behorende erven en in besloten plaatsen, met uitzondering van woningen, zijn verboden.	nan	nan	nan	nan	nan	nan	nan	nan
nan	I . Bepalingen voor evenementen, samenkomsten en het niet in acht nemen van een veilige afstand van 1,5 meter	nan	nan	nan	nan	nan	nan	nan	nan
nan	De door mij eerder verstrekte opdrachten worden met ingang van 7 april verlengd tot en met 28 april 2020.	nan	nan	nan	nan	nan	nan	nan	nan
