id	text	event1	event2	event3	event4	event5	event6	event7	event8
nan	Gehoord hebbende het advies van het Outbreak Management Team en het Bestuurlijk Afstemmingsoverleg van 23 maart 2020 en na overleg in de Ministeriële Commissie Crisisbeheersing van 23 maart 2020, geef ik u op basis van artikel 7 van de Wet publieke gezondheid, in aanvulling op de eerdere aanwijzingen voor bestrijding van de uitbraak van COVID-19, onderstaande opdracht. U dient uw bevoegdheden op het terrein van openbare orde en veiligheid als be_x0002_doeld in artikel 39 van de Wet veiligheidsregio's, waaronder, indien nodig, het op_x0002_nemen van voorschriften in een noodverordening als bedoeld in artikel 176 van de  Gemeentewet, in te zetten opdat zo spoedig mogelijk na deze aanwijzing de vol_x0002_gende maatregelen worden getroffen: 1. Verbod voor alle vergunningsplichtige en meldplichtige evenementen tot 1 juni  2020. 2. Verbod voor alle overige samenkomsten, waarbij uitzonderingen gelden voor de volgende samenkomsten, mits betrokkenen te allen tijde 1,5 meter afstand hou_x0002_den tot de dichtstbijzijnde persoon: - wettelijk verplichte samenkomsten, zoals vergaderingen van gemeenteraden, mits daarbij niet meer dan 100 personen aanwezig zijn, alsook vergaderingen van de Staten-Generaal; - samenkomsten die nodig zijn voor de continuering van de dagelijkse werkzaam_x0002_heden van instellingen, bedrijven en andere organisaties, mits daarbij niet meer dan 100 personen aanwezig zijn - uitvaarten en huwelijksvoltrekkingen mits daarbij niet meer dan 30 personen aanwezig zijn; - samenkomsten van religieuze of levensbeschouwelijke aard, mits daarbij niet meer dan 30 personen aanwezig zijn. 3. Sluiten van casino's, speelhallen en daarmee vergelijkbare instellingen, alsook  sluiten van zaken waarbinnen op de uiterlijke verzorging gerichte contactberoepen worden uitgeoefend, zoals kapperszaken en nagelsalons. 4. Verbod op het uitoefenen van alle vormen van contactberoepen, waaronder masseurs, kappers, nagelstylisten, escortservices en rij-instructeurs, voor zover deze beroepen niet naar behoren met inachtneming van 1,5 meter afstand tot de klant kunnen worden uitgeoefend. Uitgezonderd is de uitoefening van (para)medi_x0002_sche beroepen, mits voor deze uitoefening een individuele medische indicatie be_x0002_staat en daarbij door de beoefenaar alle in verband met COVID-19 benodigde hy_x0002_giënevereisten in acht worden genomen. 5. Sluiten van winkels en markten, of beëindigen van openbaar vervoer, indien deze voorzieningen zich niet of niet in voldoende mate houden aan de verwezenlij_x0002_king van de beperkende maatregelen met betrekking tot het houden van 1,5 me_x0002_ter afstand tussen alle in de voorziening aanwezige personen, of aan het op ade_x0002_quate wijze zichtbaar duidelijk maken daarvan. 6. Sluiten van alle vormen van locaties, waaronder vakantieparken, campings, parken, natuurgebieden en stranden, indien op deze locaties niet of niet in vol_x0002_doende mate de beperkende maatregel met betrekking tot het houden van 1,5 meter afstand tussen daar aanwezige personen in acht wordt genomen of het niet in acht nemen daarvan dreigt. 7. Instellen van een verbod op al dan niet toevallige groepsvorming in (bepaalde delen van) de publieke ruimte. Onder groepsvorming wordt hierbij verstaan: drie of meer personen die daarbij niet of niet in voldoende mate een onderlinge af_x0002_stand van 1,5 meter in acht nemen. Van groepsvorming is geen sprake indien het personen betreft die een gezamenlijk huishouden vormen. Daarnaast is van groepsvorming geen sprake als het kinderen tot en met 12 jaar betreft die samen_x0002_spelen onder toezicht van een of meer ouders of voogden die daarbij onderling een afstand van 1,5 meter in acht nemen. De onder 2 en 3 bedoelde verboden dient u op te nemen in een noodverordening. Voor de onder 4 tot en met 7 genoemde maatregelen kunt u een voorziening in de noodverordening te treffen, opdat optreden krachtens die verordening mogelijk is indien dat noodzakelijk is. De onder 2 tot en met 7 bedoelde maatregelen zullen uiterlij	nan	nan	nan	nan	nan	nan	nan	nan
nan	Contactberoepen	nan	nan	nan	nan	nan	nan	nan	nan
nan	Gehoord hebbende het advies van het Outbreak Management Team en het Bestuurlijk Afstemmingsoverleg van 12 maart 2020 heeft de Ministeriële Commissie Crisisbeheersing op 15 maart 2020 besloten dat er vanaf 16 maart 2020 tot en  met 6 april 2020 geen onderwijsactiviteiten en geen opvang geboden mogen worden in onderwijsinstellingenl en verblijven voor kinderopvang en gastouderopvang met enkele uitzonderingen die hierna worden beschreven.	nan	nan	nan	nan	nan	nan	nan	nan
nan	Daarnaast moeten zij aan leerlingen vragen het openbaar vervoer te mijden.	nan	nan	nan	nan	nan	nan	nan	nan
nan	De exploitant of beheerder is primair verantwoordelijk voor de naleving van de 1,5 meter en de overige voorschriften als ook de controle daarop.	nan	nan	nan	nan	nan	nan	nan	nan
nan	Openbaar vervoer	nan	nan	nan	nan	nan	nan	nan	nan
nan	a. wettelijk verplichte samenkomsten, zoals vergaderingen van gemeenteraden, mits daarbij niet meer dan 100 personen aanwezig zijn, alsook vergaderingen van de Staten-Generaal;	nan	nan	nan	nan	nan	nan	nan	nan
nan	IV Bepalingen voor verpleeghuizen en andere kleinschalige woonvormen in de ouderenzorg	nan	nan	nan	nan	nan	nan	nan	nan
