id	text	event1	event2	event3	event4	event5	event6	event7	event8
nan	Schools for special secondary education and others can open completely again.	nan	nan	nan	nan	nan	nan	nan	nan
nan	For enforcement, you can also make use of Article 47 of the Public Health Act.	nan	nan	nan	nan	nan	nan	nan	nan
nan	- gatherings of a religious or ideological nature, provided that no more than 30 people are present.	nan	nan	nan	nan	nan	nan	nan	nan
nan	Cinemas and cultural institutions.	nan	nan	nan	nan	nan	nan	nan	nan
nan	In the follow-up to this instruction, you have the option to close or keep these locations closed if you are of the opinion that the measure to keep 1.5 meters away is (expected) not being properly complied with or cannot be properly observed or that you expect or notice problems with the use of the mobility system and in particular public transport.	nan	nan	nan	nan	nan	nan	nan	nan
nan	Primary education	nan	nan	nan	nan	nan	nan	nan	nan
nan	The aforementioned educational institutions must take careful measures to limit the risk of contamination, including keeping a distance of 1.5 meters between all persons present in these institutions (as much as possible for secondary special education in special circumstances.	nan	nan	nan	nan	nan	nan	nan	nan
nan	  	nan	nan	nan	nan	nan	nan	nan	nan
nan	3 The prohibition referred to in the first paragraph does not apply to:	nan	nan	nan	nan	nan	nan	nan	nan
nan	In addition they should ask students to avoid public transport.	nan	nan	nan	nan	nan	nan	nan	nan
nan	A condition for this is that the institutions take careful measures to limit the risk of contamination, including keeping a distance of 1.5 meters between all persons present in these institutions and that students are asked to avoid public transport as much as possible.	nan	nan	nan	nan	nan	nan	nan	nan
nan	b. meetings that are necessary for the continuation of the day-to-day activities of institutions, companies and other organizations, including the organization of state exams, provided that no more than 100 people are present.	nan	nan	nan	nan	nan	nan	nan	nan
nan	I instruct you to keep the option of ceasing to act when in the exercise of contact professions, despite explicit efforts of practitioners and administrators, no 1.5 meters distance is kept between customers and / or visitors.	nan	nan	nan	nan	nan	nan	nan	nan
nan	In the follow-up of this assignment, you have the option to close these locations or keep them closed if you are of the opinion that the measure to keep 1.5 meters away is (expected) not being properly complied with or cannot be properly complied with or that you expect or notice problems with the use of the mobility system and in particular public transport.	nan	nan	nan	nan	nan	nan	nan	nan
nan	IV Provisions for nursing homes and other small-scale living arrangements in elderly care	nan	nan	nan	nan	nan	nan	nan	nan
nan	The provision in II, part 4 of the designation of 24 April will read as follows:	nan	nan	nan	nan	nan	nan	nan	nan
nan	Commercial catering establishments near or on sports facilities may be open to guests under the above conditions.	nan	nan	nan	nan	nan	nan	nan	nan
nan	7. Establishing a ban on coincidental or otherwise group formation in (certain parts of) the public space.	nan	nan	nan	nan	nan	nan	nan	nan
nan	Contact professions	nan	nan	nan	nan	nan	nan	nan	nan
nan	The prohibition on practicing the contact profession still applies to sex workers, they are not yet allowed to practice their profession.	nan	nan	nan	nan	nan	nan	nan	nan
nan	Visitors must book in advance per time slot.	nan	nan	nan	nan	nan	nan	nan	nan
nan	The institutions must make agreements with relevant parties about mobility and the use of public transport.	nan	nan	nan	nan	nan	nan	nan	nan
nan	The locations can and should, where necessary, be used for:	nan	nan	nan	nan	nan	nan	nan	nan
nan	Para-commercial food and beverage outlets that are part of outdoor sports facilities (club canteens) will remain closed.	nan	nan	nan	nan	nan	nan	nan	nan
nan	b) if it concerns the distance to children up to and including 12 years old, or	nan	nan	nan	nan	nan	nan	nan	nan
nan	Furthermore, I order you to extend the ban on the organization of events and meetings with more than 100 people in your region until April 6, 2020.	nan	nan	nan	nan	nan	nan	nan	nan
nan	The measures are described below in the following appendices:	nan	nan	nan	nan	nan	nan	nan	nan
nan	B.The prohibition on gatherings in the instruction of April 24, part I, part 2, will read as follows:2. Gatherings of more than thirty persons, excluding staff, in buildings open to the public and associated yards and in enclosed places, with the exception of houses, are prohibited.	nan	nan	nan	nan	nan	nan	nan	nan
nan	Visitors must book in advance.	nan	nan	nan	nan	nan	nan	nan	nan
nan	Naturally, those involved must always keep 1.5 meters away from the nearest person.	nan	nan	nan	nan	nan	nan	nan	nan
nan	The partial ban on opening child and out-of-school care will also lapse.	nan	nan	nan	nan	nan	nan	nan	nan
nan	On April 24 and May 8, I instructed you to use your powers in the field of public health and public order and safety totake various measures necessary to combat COVID 19.	nan	nan	nan	nan	nan	nan	nan	nan
nan	2.The prohibition referred to in the first paragraph applies to air traffic from the following countries that pose a high risk in the spread of the virus that causes COVID-19:b. China;	nan	nan	nan	nan	nan	nan	nan	nan
nan	Museums, presentation institutions and monuments with a public function may also reopen to visitors from 1 June, 12 noon.	nan	nan	nan	nan	nan	nan	nan	nan
nan	All swimming facilities can be opened from 11 May.	nan	nan	nan	nan	nan	nan	nan	nan
nan	a) that form a joint household,	nan	nan	nan	nan	nan	nan	nan	nan
nan	The instructions mentioned in the footnote) are no longer applicable from April 29, 2020.	nan	nan	nan	nan	nan	nan	nan	nan
nan	The general provisions for the closure of food and beverage outlets and terraces will remain in force at these locations until further notice.	nan	nan	nan	nan	nan	nan	nan	nan
nan	The operator or manager is primarily responsible for compliance with the 1.5 meter and other regulations, as well as for checking them.	nan	nan	nan	nan	nan	nan	nan	nan
nan	The new assignment concerns the period from April 29 to May 19, 2020.	nan	nan	nan	nan	nan	nan	nan	nan
nan	2.The prohibition referred to in the first paragraph applies to air traffic from the following countries that pose a high risk in the spread of the virus that causes COVID-19:c. Iran;	nan	nan	nan	nan	nan	nan	nan	nan
nan	The measures referred to under 2 to 7 will be reconsidered by 6 April 2020 at the latest.	nan	nan	nan	nan	nan	nan	nan	nan
nan	Allowing the exercise of contact professions also means that the establishments where the on body care-oriented contact professions are carried out again fully open and can be used.	nan	nan	nan	nan	nan	nan	nan	nan
nan	In practice, enforcement takes place by the transporters designated as supervisors and other supervisors designated under the 2000 Passenger Transport Act.	nan	nan	nan	nan	nan	nan	nan	nan
nan	As of 11 May, the practice of contact professions is allowed again.	nan	nan	nan	nan	nan	nan	nan	nan
nan	The closure of sanitary facilities in these locations only applies to communal washing and shower facilities.	nan	nan	nan	nan	nan	nan	nan	nan
nan	I order you to end the closure of swimming areas, but to keep the option to close these locations or keep them closed if you are of the opinion that the measure to keep 1.5 meters away is not is properly observed.	nan	nan	nan	nan	nan	nan	nan	nan
nan	a. flights as referred to in the first paragraph, which have already started at the time of entry into force;	nan	nan	nan	nan	nan	nan	nan	nan
nan	For swimming facilities, communal washing and shower facilities cannot be used.	nan	nan	nan	nan	nan	nan	nan	nan
nan	By way of derogation from part II, part 1 of the designation of 24 April 2020, food and beverage outlets, including terraces, may reopen to guests from 1 June from 12:00 noon under certain conditions.	nan	nan	nan	nan	nan	nan	nan	nan
nan	II. Provisions for companies and locations, contact professions and public transport facilities	nan	nan	nan	nan	nan	nan	nan	nan
nan	Dance venues remain closed.	nan	nan	nan	nan	nan	nan	nan	nan
nan	The 1.5 m is maintained for 3 people.	nan	nan	nan	nan	nan	nan	nan	nan
nan	The measures will be reconsidered no later than April 28.	nan	nan	nan	nan	nan	nan	nan	nan
nan	In the dying phase or comparable circumstances, an institution may occasionally deviate from this measure.	nan	nan	nan	nan	nan	nan	nan	nan
nan	A visibly separated stage is considered a separate space.	nan	nan	nan	nan	nan	nan	nan	nan
nan	Primary education will be fully resumed from 8 June, unless it appears before the spread of the virus is not justified.	nan	nan	nan	nan	nan	nan	nan	nan
nan	2.The prohibition referred to in the first paragraph applies to air traffic from the following countries that pose a high risk in the spread of the virus that causes COVID-19:a. Italy;	nan	nan	nan	nan	nan	nan	nan	nan
nan	- the organization of tests and exams, provided that careful measures have been taken to limit the risk of contamination.	nan	nan	nan	nan	nan	nan	nan	nan
nan	The prohibition order for events will be extended until September 1, 2020.	nan	nan	nan	nan	nan	nan	nan	nan
nan	The Minister of Infrastructure and Water Management, acting in accordance with the Minister for Medical Care and Sport,	nan	nan	nan	nan	nan	nan	nan	nan
nan	For meetings of up to thirty people, the parties involved must always keep 1.5 meters away from the nearest person.	nan	nan	nan	nan	nan	nan	nan	nan
nan	The operator or manager is primarily responsible for compliance with the 1.5 meters and the other regulations, as well as for checking them.	nan	nan	nan	nan	nan	nan	nan	nan
nan	1.5 meter standard and meetings	nan	nan	nan	nan	nan	nan	nan	nan
nan	In this assignment I have processed and adapted the previous instructions that I have provided to all chairpersons of the security region.	nan	nan	nan	nan	nan	nan	nan	nan
nan	3. There is a prohibition against not observing a distance of 1.5 meters in public spaces (incl. Vessels and vehicles).	nan	nan	nan	nan	nan	nan	nan	nan
nan	- funerals and weddings, provided that no more than 30 people are present;	nan	nan	nan	nan	nan	nan	nan	nan
nan	Secondary education	nan	nan	nan	nan	nan	nan	nan	nan
nan	A maximum of 30 visitors may be present at the same time per individual room within these institutions.	nan	nan	nan	nan	nan	nan	nan	nan
nan	The ban on offering educational activities in educational institutions will be lifted for secondary education from 2 June.	nan	nan	nan	nan	nan	nan	nan	nan
nan	Toilets can be used.	nan	nan	nan	nan	nan	nan	nan	nan
nan	5. Closure of shops and markets, or termination of public transport, if these facilities do not or not sufficiently comply with the realization of the restrictive measures with regard to keeping 1.5 meters of distance between all persons present in the facility, or to make it clearly visible in an adequate manner.	nan	nan	nan	nan	nan	nan	nan	nan
nan	An exception is also possible for structural volunteers.	nan	nan	nan	nan	nan	nan	nan	nan
nan	2.The prohibition referred to in the first paragraph applies to air traffic from the following countries that pose a high risk in the spread of the virus that causes COVID-19:f. Austria.	nan	nan	nan	nan	nan	nan	nan	nan
nan	The managers of the swimming facilities are responsible for ensuring that the measure to maintain a distance of 1.5 meters is properly complied with in and around the swimming facilities.	nan	nan	nan	nan	nan	nan	nan	nan
nan	This also applies to public locations, such as museums, concert halls, theaters and sports competitions.	nan	nan	nan	nan	nan	nan	nan	nan
nan	1 ° non-Dutch residents have a demonstrable transit,	nan	nan	nan	nan	nan	nan	nan	nan
nan	A food and drink facility that also has a dance floor may remain open, provided the dance floor is closed.	nan	nan	nan	nan	nan	nan	nan	nan
nan	Having heard the advice of the Outbreak Management Team and the Administrative Coordination Consultation of 12 March 2020, the Ministerial CommitteeCrisis management decided on March 15, 2020 that from March 16, 2020 to April 6, 2020, no educational activities and no care may be provided in educational institutions and accommodation for childcare and childminders, with some exceptions described below.	nan	nan	nan	nan	nan	nan	nan	nan
nan	Food and beverage outlets that are part of establishments that are still closed will remain closed, unless this instruction dictates otherwise.	nan	nan	nan	nan	nan	nan	nan	nan
nan	- Outside sports and exercise for people aged 19 and older is allowed, including in a team. For this age group, as with the age groups up to 19 years, they are not allowed to organize competitions, participate in competitions and for sports and exercise are not allowed to use communal washing  shower facilities.	nan	nan	nan	nan	nan	nan	nan	nan
nan	Public transport	nan	nan	nan	nan	nan	nan	nan	nan
nan	The instruction I have previously given will be extended from April 7 until April 28, 2020.	nan	nan	nan	nan	nan	nan	nan	nan
nan	III. Provisions for educational establishments and residences for childcare, out-of-school care and childminder care	nan	nan	nan	nan	nan	nan	nan	nan
nan	The managers of these locations are responsible for making plans with which they ensure, among other things, that the 1.5 meters distance is preserved and the burden on the mobility system and in particular public transport remains acceptable.	nan	nan	nan	nan	nan	nan	nan	nan
nan	2.The prohibition referred to in the first paragraph applies to air traffic from the following countries that pose a high risk in the spread of the virus that causes COVID-19:e. Spain;	nan	nan	nan	nan	nan	nan	nan	nan
nan	A maximum of 30 guests per building may be present in the indoor area of food and beverage outlets.	nan	nan	nan	nan	nan	nan	nan	nan
nan	The previous exceptions for organized outdoor sports and exercise for children up to and including 18 years also include, under the same conditions (organized, outdoors, 13 to 18 years of age keep their distance), activities of scouting, culture, art , and other youth associations.	nan	nan	nan	nan	nan	nan	nan	nan
nan	This also applies to public locations, such as museums, concert halls, theaters and sports clubs and sports competitions.	nan	nan	nan	nan	nan	nan	nan	nan
nan	Libraries, theme parks and zoos	nan	nan	nan	nan	nan	nan	nan	nan
nan	Swimming facilities and sports clubs	nan	nan	nan	nan	nan	nan	nan	nan
nan	The institutions must organize the admission and residence times and the layout of the institution in such a way that visitors can always keep 1.5 meters away, with the exception of persons who form a joint household.	nan	nan	nan	nan	nan	nan	nan	nan
nan	In view of Article 21 of Regulation (EC) No. 1008/2008 of the European Parliament and the Council of 24 September 2008 on common rules for the operation of air services in the Community (PbEU 2008, L 293) and Article 5.10, first paragraph, part a, of the Aviation Act;	nan	nan	nan	nan	nan	nan	nan	nan
nan	1. Prohibition for all licensed and reporting events until 1 June 2020.	nan	nan	nan	nan	nan	nan	nan	nan
nan	There will be a reconsideration no later than the week of May 12, 2020 take place of the measures that apply up to and including 19 May.	nan	nan	nan	nan	nan	nan	nan	nan
nan	With regard to this prohibition, the 1.5 meters in the public space is enforced from three people.	nan	nan	nan	nan	nan	nan	nan	nan
nan	Assessment and practice (targeted) education secondary vocational education and higher education	nan	nan	nan	nan	nan	nan	nan	nan
nan	The managers of these locations are responsible for making plans with which they ensure, among other things, that the 1.5 meters distance is maintained and that the burden on the mobility system and in particular public transport remains acceptable.	nan	nan	nan	nan	nan	nan	nan	nan
nan	Toilets can be used.	nan	nan	nan	nan	nan	nan	nan	nan
nan	By way of derogation from part I, parts 1 and 2, of the designation of 24 April 2020, cinemas, cinemas, concert halls, stages for all genres of music, theaters and similar cultural institutions may organize activities aimed at the public from 1 June at 12:00 noon.	nan	nan	nan	nan	nan	nan	nan	nan
nan	Museums, presentation institutions and monuments.	nan	nan	nan	nan	nan	nan	nan	nan
nan	Outdoor sports and exercise	nan	nan	nan	nan	nan	nan	nan	nan
nan	6. Closure of all forms of locations, including holiday parks, camping sites, parks, nature reserves and beaches, if at these locations not or not sufficiently the restrictive measure with regard to keeping 1.5 meters distance between persons present there is observed or there is a threat of non-observance thereof.	nan	nan	nan	nan	nan	nan	nan	nan
nan	Exceptions from this instruction are hotels, home-delivered meals and catering.	nan	nan	nan	nan	nan	nan	nan	nan
nan	- gatherings of a religious or spiritual nature, provided that no more than 30 people are present.	nan	nan	nan	nan	nan	nan	nan	nan
nan	If you find that educational institutions or providers of childcare or childminder care are not complying with this crisis measure and there are persistently more pupils, students or children present at a location than is necessary for the aforementioned purposes, I will instruct you on the basis of Article 7 of the The Public Health Act and with due observance of Article 39, first paragraph, of the Safety Regions Act, to close the educational institution or the accommodation for childcare or childminder care, for example by means of an emergency order.	nan	nan	nan	nan	nan	nan	nan	nan
nan	This prohibition applies not if it concerns persons	nan	nan	nan	nan	nan	nan	nan	nan
nan	Article 2. (Prohibition of civil air traffic)	nan	nan	nan	nan	nan	nan	nan	nan
nan	2. Prohibition for all other gatherings, with exceptions for the following gatherings, provided that those involved keep 1.5 meters away from the nearest person at all times:	nan	nan	nan	nan	nan	nan	nan	nan
nan	I also order you to make an exception to the closure of establishments for sports and exercise insofar as this is necessary to make outdoor sports possible for persons aged 19 years and older.	nan	nan	nan	nan	nan	nan	nan	nan
nan	Decides:	nan	nan	nan	nan	nan	nan	nan	nan
nan	In addition, there is no group formation if it concerns children up to the age of 12 who play together under the supervision of one or more parents or guardians who observe a mutual distance of 1.5 meters.	nan	nan	nan	nan	nan	nan	nan	nan
nan	This means that from 11 May it will also be possible to exercise and exercise in indoor swimming areas.	nan	nan	nan	nan	nan	nan	nan	nan
nan	C. Where reasonably necessary, vulnerable young people (13-18) among themselves and vulnerable young people with youth professionals may deviate from the 1.5 meter measure in youth aid.	nan	nan	nan	nan	nan	nan	nan	nan
nan	All those present must keep a distance of 1.5 meters from each other, with the exception of persons who form a joint household.	nan	nan	nan	nan	nan	nan	nan	nan
nan	1 Om redenen van openbare orde en veiligheid is ter bescherming van de volksgezondheid de uitoefening van burgerluchtverkeer in het luchtruim boven Nederland verboden voor luchtverkeer dat het vervoer van passagiers tot doel heeft, met luchthavens gelegen op Nederlands grondgebied als plaats van bestemming.	nan	nan	nan	nan	nan	nan	nan	nan
nan	All guests must use a seat at a table or bar.	nan	nan	nan	nan	nan	nan	nan	nan
nan	I instruct you to add an exception to the earlier prohibition of gatherings;	nan	nan	nan	nan	nan	nan	nan	nan
nan	For the rest, the instruction of April 24 and May 8 are extended.	nan	nan	nan	nan	nan	nan	nan	nan
nan	The prohibition on offering educational activities in educational institutions in secondary vocational education and higher education will be lifted as of 15 June for holding exams, exams, tests, practical (specific) education and supervision of vulnerable students at the educational institution, insofar as this is online. Cannot be sufficient.	nan	nan	nan	nan	nan	nan	nan	nan
nan	The same rules apply to terraces in covered shopping centers as to the indoor areas of food and beverage outlets.	nan	nan	nan	nan	nan	nan	nan	nan
nan	The operator or manager must arrange the terrace in such a way that guests and staff can always keep a distance of one and a half meters from each other.	nan	nan	nan	nan	nan	nan	nan	nan
nan	There is no group formation if it concerns persons who form a joint household.	nan	nan	nan	nan	nan	nan	nan	nan
nan	b. repatriation of EU or Schengen and United Kingdom residents, where:	nan	nan	nan	nan	nan	nan	nan	nan
nan	I now order you to take some measures with effect from 1 June 2020, 12:00 noon and, as far as secondary vocational education and higher education are concerned, 15 June 2020, to be adjusted.	nan	nan	nan	nan	nan	nan	nan	nan
nan	- the (emergency) care of children of parents who work in crucial professions or for vital processes, as described on www.rijksoverheid.nl. Emergency shelter is organized by municipalities, supported by the Association of Dutch Municipalities;	nan	nan	nan	nan	nan	nan	nan	nan
nan	The 1.5 m is maintained from 3 people.	nan	nan	nan	nan	nan	nan	nan	nan
nan	- legally required meetings, such as meetings of municipal councils, provided that no more than 100 people are present, as well as meetings of the States General;	nan	nan	nan	nan	nan	nan	nan	nan
nan	Within these venues, those present must keep 1.5 meters away, with the exception of persons who form a joint household.	nan	nan	nan	nan	nan	nan	nan	nan
nan	You must exercise your powers in the field of public order and safety as referred to in Article 39 of the Security Regions Act, including, if necessary, including regulations in an emergency ordinance as referred to in Article 176 of the Municipalities Act. so that the following measures are taken as soon as possible after this designation:	nan	nan	nan	nan	nan	nan	nan	nan
nan	Having heard the advice of the Outbreak Management Team and the Administrative Coordination Consultation of March 23, 2020 and after consultation in the Ministerial Crisis Management Committee of March 23, 2020, I give you on the basis of Article 7 of the Public Health Act, in addition to the earlier instructions in front offight the COVID-19 outbreak, command below.	nan	nan	nan	nan	nan	nan	nan	nan
nan	Guests must book in advance.	nan	nan	nan	nan	nan	nan	nan	nan
nan	c. the transport of medical personnel or patients when this is in the interest of public health.	nan	nan	nan	nan	nan	nan	nan	nan
nan	Guests must book in advance.	nan	nan	nan	nan	nan	nan	nan	nan
nan	Contact professionals and the administrators of establishments where contact professions are exercised are responsible for arranging and organizing the measures necessary to do the work in a careful manner.	nan	nan	nan	nan	nan	nan	nan	nan
