id	text	event1	event2	event3	event4	event5	event6	event7	event8
nan	Fait à Paris, le 11 mai 2020.Emmanuel MacronPar le Président de la République :Le Premier ministre,Edouard PhilippeLa garde des sceaux, ministre de la justice,Nicole BelloubetLa ministre de la transition écologique et solidaire,Elisabeth BorneLe ministre des solidarités et de la santé,Olivier VéranLe ministre de l'économie et des finances,Bruno Le MaireLe ministre de l'intérieur,Christophe CastanerLa ministre des outre-mer,Annick GirardinLe secrétaire d'Etat auprès de la ministre de la transition écologique et solidaire, chargé des transports,Jean-Baptiste Djebbari	nan	nan	nan	nan	nan	nan	nan	nan
nan	Jusqu'au 15 avril 2020, il est interdit aux navires de croisière et aux navires à passagers transportant plus de 100 passagers de faire escale en Corse, et de faire escale ou de mouiller dans les eaux intérieures et les eaux territoriales des départements et régions d'outre-mer, ainsi que de Saint-Barthélemy et Saint-Martin, Saint-Pierre-et-Miquelon, et Wallis-et-Futuna, sauf dérogation accordée par le représentant de l'Etat compétent pour ces mêmes collectivités.	nan	nan	nan	nan	nan	nan	nan	nan
nan	En matière correctionnelle, par dérogation aux dispositions du premier alinéa de l'article L. 251-3 du code de l'organisation judiciaire, le tribunal pour enfants peut statuer en n'étant composé que de son seul président, ou d'un juge des enfants, et à défaut d'un magistrat désigné pour le remplacer, sur décision du président du tribunal judiciaire constatant que la réunion de la formation collégiale de la juridiction n'est pas possible, sans préjudice de la possibilité pour le président de renvoyer l'affaire à une formation collégiale si ce renvoi lui paraît justifié en raison de la complexité ou de la gravité des faits.	nan	nan	nan	nan	nan	nan	nan	nan
nan	I. - Sont interdits, jusqu'au 15 avril 2020, sauf s'ils relèvent de l'une des exceptions mentionnées au II, les déplacements de personnes par transport commercial aérien :- au départ du territoire hexagonal et à destination de La Réunion, Mayotte, la Guadeloupe, la Martinique, la Guyane, Saint-Martin et Saint-Barthélemy ;	nan	nan	nan	nan	nan	nan	nan	nan
nan	Article 1Aéroports de Paris est autorisée à suspendre temporairement l'exploitation commerciale de l'aéroport de Paris-Orly à compter du 31 mars 2020 à 23 h 30.Aéroports de Paris procède aux changements d'affectation provisoires des compagnies qui souhaitent poursuivre leurs activités sur l'aéroport de Paris-Charles-de-Gaulle. Le délai prévu au V de l'article 6 du cahier des charges annexé au décret du 20 juillet 2005 susvisé est réduit à quatre jours.	nan	nan	nan	nan	nan	nan	nan	nan
nan	I. - Une mesure de mise en quarantaine ou de placement et maintien en isolement ne peut être prescrite à l'entrée sur le territoire hexagonal ou à l'arrivée en Corse ou dans l'une des collectivités mentionnées à l'article 72-3 de la Constitution que pour les personnes ayant séjourné, au cours du mois précédant cette entrée ou cette arrivée, dans une zone de circulation de l'infection définie par arrêté du ministre chargé de la santé mentionné au II de l'article L.3131-15 du code de la santé publique.	nan	nan	nan	nan	nan	nan	nan	nan
nan	4° Imposer aux personnes souhaitant se déplacer par transport public aérien à destination ou en provenance du territoire métropolitain ou de l'une des collectivités mentionnées à l'article 72-3 de la Constitution de présenter le résultat d'un examen biologique de dépistage virologique ne concluant pas à une contamination par le covid-19.	nan	nan	nan	nan	nan	nan	nan	nan
nan	- établissements de type T : Etablissements à vocation commerciale destinés à des expositions, des foires-expositions ou des salons ayant un caractère temporaire ;	nan	nan	nan	nan	nan	nan	nan	nan
nan	-Dans les départements mentionnés à l'annexe 2, tout déplacement de personne hors de son lieu de résidence est interdit entre 6 heures et 19 heures à l'exception des déplacements pour les motifs mentionnés au I et les motifs suivants, en évitant tout regroupement de personnes :	nan	nan	nan	nan	nan	nan	nan	nan
nan	Un centre d'hébergement destiné à maintenir en quarantaine les personnes ayant résidé à Wuhan (Chine) et arrivant sur le territoire français est ouvert dans le département des Bouches-du-Rhône.	nan	nan	nan	nan	nan	nan	nan	nan
nan	- Dans les territoires sortis de l'état d'urgence sanitaire, les établissements recevant du public relevant des types suivants définis par le règlement pris en application de l'article R. 123-12 du code de la construction et de l'habitation ne peuvent accueillir du public que dans le respect des conditions prévues au présent article :	nan	nan	nan	nan	nan	nan	nan	nan
nan	TITRE IV CONTRÔLE PARLEMENTAIRE Article 22 Pour les commissions d’enquête constituées avant la publication de la présente loi et dont le rapport n’a pas encore été déposé, le délai mentionné à la deuxième phrase du dernier alinéa du I de l’article 6 de l’ordonnance no 58-1100 du 17 novembre 1958 relative au fonctionnement des assemblées parlementaires est porté à huit mois, sans que leur mission puisse se poursuivre au-delà du 30 septembre 2020.	nan	nan	nan	nan	nan	nan	nan	nan
nan	-En cas de déclaration de l'état d'urgence sanitaire, il est réuni sans délai un comité de scientifiques. Son président est nommé par décret du Président de la République. Ce comité comprend deux personnalités qualifiées respectivement nommées par le Président de l'Assemblée nationale et le Président du Sénat ainsi que des personnalités qualifiées nommées par décret. Le comité rend périodiquement des avis sur l'état de la catastrophe sanitaire, les connaissances scientifiques qui s'y rapportent et les mesures propres à y mettre un terme, y compris celles relevant des articles L. 3131-15 à L. 3131-17, ainsi que sur la durée de leur application. Ces avis sont rendus publics sans délai. Le comité est dissous lorsque prend fin l'état d'urgence sanitaire.	nan	nan	nan	nan	nan	nan	nan	nan
nan	VIII. - Il est instauré un Comité de contrôle et de liaison covid-19 chargé d'associer la société civile et le Parlement aux opérations de lutte contre la propagation de l'épidémie par suivi des contacts ainsi qu'au déploiement des systèmes d'information prévus à cet effet.Ce comité est chargé, par des audits réguliers :1° D'évaluer, grâce aux retours d'expérience des équipes sanitaires de terrain, l'apport réel des outils numériques à leur action, et de déterminer s'ils sont, ou pas, de nature à faire une différence significative dans le traitement de l'épidémie ;2° De vérifier tout au long de ces opérations le respect des garanties entourant le secret médical et la protection des données personnelles.Sa composition, qui inclut deux députés et deux sénateurs désignés par les présidents de leurs assemblées respectives, et la mise en œuvre de ses missions sont fixées par décret.Les membres du comité exercent leurs fonctions à titre gratuit.	nan	nan	nan	nan	nan	nan	nan	nan
nan	Le transporteur maritime ou fluvial peut demander au passager de présenter, avant son embarquement, une déclaration sur l'honneur attestant qu'il ne présente pas de symptôme d'infection au covid-19 et qu'il n'a pas connaissance d'avoir été en contact avec un cas confirmé de covid-19 dans les quatorze jours précédant l'embarquement. À défaut, l'accès peut lui être refusé et il peut être reconduit à l'extérieur des espaces concernés.	nan	nan	nan	nan	nan	nan	nan	nan
nan	-Dans les circonscriptions territoriales où l'état d'urgence sanitaire est déclaré, le Premier ministre peut, par décret réglementaire pris sur le rapport du ministre chargé de la santé, aux seules fins de garantir la santé publique :« 4° Ordonner des mesures de placement et de maintien en isolement, au sens du même article 1er, à leur domicile ou tout autre lieu d'hébergement adapté, des personnes affectées ;	nan	nan	nan	nan	nan	nan	nan	nan
nan	Et après avoir entendu le rapporteur ;Le Conseil constitutionnel s'est fondé sur ce qui suit :1. La loi organique soumise à l'examen du Conseil constitutionnel a été prise sur le fondement de l'article 61-1 de la Constitution.	nan	nan	nan	nan	nan	nan	nan	nan
nan	IX. - L'Assemblée nationale et le Sénat sont informés sans délai des mesures mises en œuvre par les autorités compétentes en application du présent article.[Dispositions déclarées non conformes à la Constitution par la décision du Conseil constitutionnel n° 2020-800 DC du 11 mai 2020.]Le Gouvernement adresse au Parlement un rapport détaillé de l'application de ces mesures tous les trois mois à compter de la promulgation de la présente loi et jusqu'à la disparition des systèmes d'information développés aux fins de lutter contre la propagation de l'épidémie de covid-19. Ces rapports sont complétés par un avis public de la Commission nationale de l'informatique et des libertés.	nan	nan	nan	nan	nan	nan	nan	nan
nan	-Dans les circonscriptions territoriales où l'état d'urgence sanitaire est déclaré, le Premier ministre peut, par décret réglementaire pris sur le rapport du ministre chargé de la santé, aux seules fins de garantir la santé publique :« 1° Restreindre ou interdire la circulation des personnes et des véhicules dans les lieux et aux heures fixés par décret ;	nan	nan	nan	nan	nan	nan	nan	nan
nan	Par dérogation aux dispositions de l'article 50 du code de procédure pénale, si le ou les juges d'instruction sont absents, malades ou autrement empêchés, le président du tribunal judiciaire ou, en cas d'empêchement, le magistrat qui le remplace désigne le ou les magistrats du siège pour exercer les fonctions de juge d'instruction. Il peut établir, à cette fin, un tableau de roulement.Les désignations prévues au présent article sont des mesures d'administration judiciaire.	nan	nan	nan	nan	nan	nan	nan	nan
nan	I. - Sont suspendus du 16 au 29 mars 2020 :1° L'accueil des usagers des structures mentionnées aux articles L. 214-1, L.227-4 et L. 424-1 du code de l'action sociale et des familles, à l'exception des structures attachées à des établissements de santé et de celles mentionnées au 4° de l'article R. 2324-17 du code de la santé publique ;	nan	nan	nan	nan	nan	nan	nan	nan
nan	3° Etablissements de type P : Salles de danse et salles de jeux ;	nan	nan	nan	nan	nan	nan	nan	nan
nan	2° Dans les maisons d'assistants maternels visées à l'article L. 424-1 du code de l'action sociale et des familles, l'accueil est assuré en groupes autonomes de dix enfants au maximum, dans le respect des limitations fixées au deuxième alinéa du même article et au premier alinéa de l'article L. 424-5 du même code.	nan	nan	nan	nan	nan	nan	nan	nan
nan	Dans les écoles élémentaires et les collèges, l'observation d'une distanciation physique d'au moins un mètre s'applique uniquement dans les salles de classe et tous les espaces clos, entre l'enseignant et les élèves ainsi qu'entre chaque élève lorsqu'ils sont côte à côte ou qu'ils se font face. L'accueil est assuré par groupes qui ne peuvent pas se mélanger	nan	nan	nan	nan	nan	nan	nan	nan
nan	I. - Les établissements recevant du public relevant des types suivants définis par le règlement pris en application de l'article R. 123-12 du code de la construction et de l'habitation ne peuvent accueillir du public que dans le respect des conditions prévues au présent article :- établissements de type N : Restaurants et débits de boissons ;	nan	nan	nan	nan	nan	nan	nan	nan
nan	Dans les territoires sortis de l'état d'urgence sanitaire, les établissements recevant du public figurant ci-après ne peuvent accueillir de public que dans les conditions prévues au présent article	nan	nan	nan	nan	nan	nan	nan	nan
nan	ne peuvent plus accueillir du public jusqu'au 15 avril 2020 : - au titre de la catégorie CTS : Chapiteaux, tentes et structures ;	nan	nan	nan	nan	nan	nan	nan	nan
nan	Les personnes de onze ans ou plus souhaitant se déplacer par transport public aérien à destination du territoire métropolitain depuis un pays étranger mentionné sur la liste figurant en annexe 2 bis présentent à l'embarquement le résultat d'un examen biologique de dépistage virologique réalisé moins de 72 heures avant le vol ne concluant pas à une contamination par le covid-19.	nan	nan	nan	nan	nan	nan	nan	nan
nan	Les dispositions des articles 9, 10 et celles du premier alinéa de l'article 11 n'entrent en vigueur, dans tout ou partie des juridictions, qu'en application d'un décret constatant la persistance d'une crise sanitaire de nature à compromettre le fonctionnement des juridictions malgré la mise en œuvre des autres dispositions de la présente ordonnance.	nan	nan	nan	nan	nan	nan	nan	nan
nan	2° Etablissements de type EF : Etablissements flottants pour leur activité de restauration et de débit de boisson ;	nan	nan	nan	nan	nan	nan	nan	nan
nan	3° Déplacements pour consultation de santé et soins spécialisés ne pouvant être assurés à distance ou à proximité du domicile ;	nan	nan	nan	nan	nan	nan	nan	nan
nan	Afin de prévenir la propagation du virus covid-19, tout rassemblement mettant en présence de manière simultanée plus de 1 000 personnes est interdit sur le territoire national jusqu'au 15 avril 2020.	nan	nan	nan	nan	nan	nan	nan	nan
nan	Le renouvellement général des conseillers des Français de l'étranger et des délégués consulaires initialement prévu en mai 2020 par le décret n° 2020-83 du 4 février 2020 est reporté au mois de juin 2020. Sa date est fixée par un décret publié au plus tard quarante jours avant le scrutin.	nan	nan	nan	nan	nan	nan	nan	nan
nan	V. - Aucun événement réunissant plus de 5 000 personnes ne peut se dérouler sur le territoire de la République.	nan	nan	nan	nan	nan	nan	nan	nan
nan	I. - Une mesure de mise en quarantaine ou de placement et maintien en isolement peut être prescrite à l'entrée sur le territoire national ou à l'arrivée en Corse ou dans l'une des collectivités mentionnées à l'article 72-3 de la Constitution, pour toute personne ayant séjourné, au cours du mois précédant cette entrée ou cette arrivée, dans une zone de circulation de l'infection définie par arrêté du ministre chargé de la santé.	nan	nan	nan	nan	nan	nan	nan	nan
nan	EF : Etablissements flottants ;	nan	nan	nan	nan	nan	nan	nan	nan
nan	8° Déplacements aux seules fins de participer à des missions d'intérêt général sur demande de l'autorité administrative et dans les conditions qu'elle précise.	nan	nan	nan	nan	nan	nan	nan	nan
nan	IX. - Les dispositions du présent IX s'appliquent aux services de transport public particulier de personnes, ainsi qu'aux services privés ou publics de transport collectif réalisés avec des véhicules de moins de neuf places, hors conducteur, sans préjudice des dispositions particulières applicables au transport de malades assis.Un affichage rappelant les mesures d'hygiène et de distanciation sociale dites « barrières » visible pour les passagers est mis en place à l'intérieur du véhicule.Aucun passager n'est autorisé à s'asseoir à côté du conducteur. Un seul passager est admis. Par dérogation, lorsque que le conducteur est séparé des passagers par une paroi transparente fixe ou amovible, plusieurs passagers sont admis s'ils appartiennent au même foyer ou, dans le cas de transport d'élève en situation de handicap, mentionné à l'article L. 242-1 du code de l'action sociale et des familles.	nan	nan	nan	nan	nan	nan	nan	nan
nan	le Premier ministre peut, par décret réglementaire pris sur le rapport du ministre chargé de la santé, aux seules fins de garantir la santé publique :10° En tant que de besoin, prendre par décret toute autre mesure réglementaire limitant la liberté d'entreprendre, dans la seule finalité de mettre fin à la catastrophe sanitaire mentionnée à l'article L. 3131-12 du présent code.	nan	nan	nan	nan	nan	nan	nan	nan
nan	IV. - Le préfet de département est habilité à interdire ou à restreindre, par des mesures réglementaires ou individuelles, les rassemblements, réunions ou activités auxquels la déclaration mentionnée au II n'est pas applicable lorsque les circonstances locales l'exigent.	nan	nan	nan	nan	nan	nan	nan	nan
nan	3° Après l'article 18, il est inséré un article 18-1 ainsi rédigé :« Art. 18-1.-Par dérogation à l'article 148-4 du code de procédure pénale, la chambre de l'instruction peut être directement saisie d'une demande de mise en liberté lorsque la personne n'a pas comparu, dans les deux mois suivant la prolongation de plein droit de la détention provisoire intervenue en application de l'article 16 de la présente ordonnance, devant le juge d'instruction ou le magistrat par lui délégué, y compris selon les modalités prévues à l'article 706-71 du code de procédure pénale. Le cas échéant, la chambre de l'instruction statue dans les conditions prévues au premier alinéa de l'article 18 de la présente ordonnance. »	nan	nan	nan	nan	nan	nan	nan	nan
nan	I. - 1° Dans les établissements et services d'accueil du jeune enfant mentionnés à l'article R. 2324-17 du code de la santé publique ainsi que dans les maisons d'assistants maternels visées à l'article L. 424-1 du code de l'action sociale et des familles, l'accueil est assuré en groupes autonomes de dix enfants maximum et dans le respect les dispositions prévues au même code ainsi que des dispositions suivantes :a) Pour chaque groupe de dix enfants maximum que comporte l'établissement, celui-ci respecte les exigences définies au dernier alinéa de l'article R. 2324-42 du code de la santé publique, au deuxième alinéa de l'article R. 2324-43-1 ainsi qu'aux quatre premiers alinéas de l'article R. 2324-36-1 du même code ;b) Lorsqu'un établissement accueille plusieurs groupes d'enfants pour un total de vingt enfants ou plus, les exigences en matière de direction fixées au cinquième alinéa de l'article R. 2324-36-1 du code la santé publique s'appliquent et l'effectif du personnel encadrant directement les enfants comporte toujours au moins un des professionnels mentionnés au 1° de l'article R. 2324-42 du même code ;c) Dans les crèches dites familiales mentionnées au 1° de l'article R. 2324-17 ainsi que dans les relais d'assistants maternels prévus à l'article L. 214-2-1 du code de l'action sociale et des familles, les regroupements de professionnels en présence des enfants qui leur sont confiés sont interdits ;	nan	nan	nan	nan	nan	nan	nan	nan
nan	Le secrétaire d'Etat auprès de la ministre de la transition écologique et solidaire, chargé des transports,Vu le code de l'aviation civile, notamment ses articles R. 221-2 et R. 221-3 et son article R. 216-11 ;Vu le code des transports, notamment ses articles L. 6323-1 à L. 6323-4 ;Vu le décret n° 2005-828 du 20 juillet 2005 relatif à la société Aéroports de Paris ;Vu la demande de suspension du trafic aérien commercial faite par Aéroports de Paris en date du 27 mars 2020 ;Vu les circonstances exceptionnelles découlant de l'épidémie de covid-19,Arrête :	nan	nan	nan	nan	nan	nan	nan	nan
nan	Dans les cas où le lieu d'exercice de l'activité professionnelle est le domicile du client, les déplacements mentionnés au a du 1° du I de l'article 4 ne sont, sauf intervention urgente, livraison ou lorsqu'ils ont pour objet l'assistance à des personnes vulnérables ou précaires ou la garde d'enfants, autorisés qu'entre 6 heures et 19 heures.	nan	nan	nan	nan	nan	nan	nan	nan
nan	Les agents mentionnés aux articles L. 511-1, L. 521-1, L. 531-1 et L. 532-1 du code de la sécurité intérieure peuvent constater par procès-verbaux les contraventions prévues au troisième alinéa du présent article lorsqu'elles sont commises respectivement sur le territoire communal, sur le territoire pour lequel ils sont assermentés ou sur le territoire de la Ville de Paris et qu'elles ne nécessitent pas de leur part d'actes d'enquête.	nan	nan	nan	nan	nan	nan	nan	nan
nan	A compter du 23 décembre 2020 à zéro heure et jusqu'au 6 janvier 2021 inclus, toute personne arrivant en France en provenance du Royaume-Uni présente, à l'entreprise de transport, avant son embarquement : Si elle est âgée de onze ans ou plus, le résultat d'un test ou d'un examen biologique de dépistage virologique réalisé moins de 72 heures avant l'embarquement ne concluant pas à une contamination par le covid-19. Les seuls tests antigéniques pouvant être valablement présentés pour l'application du présent 2° sont ceux permettant la détection de la protéine N du SARS-CoV-2.	nan	nan	nan	nan	nan	nan	nan	nan
nan	5° Déplacements brefs, dans la limite d'une heure quotidienne et dans un rayon maximal d'un kilomètre autour du domicile, liés soit à l'activité physique individuelle des personnes, à l'exclusion de toute pratique sportive collective et de toute proximité avec d'autres personnes, soit à la promenade avec les seules personnes regroupées dans un même domicile, soit aux besoins des animaux de compagnie ;	nan	nan	nan	nan	nan	nan	nan	nan
nan	3° Sans préjudice des articles L. 211-2 et L. 211-4 du code de la sécurité intérieure, réglementer les rassemblements de personnes, les réunions et les activités sur la voie publique et dans les lieux ouverts au public ;	nan	nan	nan	nan	nan	nan	nan	nan
nan	Considérant que le respect des règles de distance dans les rapports interpersonnels est l'une des mesures les plus efficaces pour limiter la propagation du virus ; qu'il y a lieu de les observer en tout lieu et en toute circonstance avec les autres mesures dites barrières, notamment d'hygiène, prescrites au niveau national ;Considérant que l'observation des règles de distance étant particulièrement difficile au sein de certains établissements recevant du public, il y a lieu de fermer ceux qui ne sont pas indispensables à la vie de la Nation tels que les cinémas, bars ou discothèques ; qu'il en va de même des commerces à l'exception de ceux présentant un caractère indispensable comme les commerces alimentaires, pharmacies, banques, stations-services ou de distribution de la presse ; qu'il y a lieu de préciser la liste des établissements et activités concernés et le régime qui leur est applicable en fonction de leurs spécificités	nan	nan	nan	nan	nan	nan	nan	nan
nan	I. - Dans les établissements et services d'accueil du jeune enfant mentionnés à l'article R. 2324-17 du code de la santé publique, dans les maisons d'assistants maternels mentionnées à l'article L. 424-1 du code de l'action sociale et des familles et dans les relais d'assistants maternels mentionnés à l'article L. 214-2-1 du même code, l'accueil est assuré dans le respect des dispositions qui leur sont applicables et dans des conditions permettant de limiter au maximum le brassage des enfants appartenant à des groupes différents.	nan	nan	nan	nan	nan	nan	nan	nan
nan	1° Réglementer ou, dans certaines parties du territoire dans lesquelles est constatée une circulation active du virus, interdire la circulation des personnes et des véhicules, ainsi que l'accès aux moyens de transport collectif et les conditions de leur usage et, pour les seuls transports aériens et maritimes, interdire ou restreindre les déplacements de personnes et la circulation des moyens de transport, sous réserve des déplacements strictement indispensables aux besoins familiaux, professionnels et de santé ;	nan	nan	nan	nan	nan	nan	nan	nan
nan	I. - Les établissements suivants mentionnés au livre III du code du tourisme ne peuvent accueillir de public que dans le respect des dispositions du présent titre :1° Les auberges collectives ;	nan	nan	nan	nan	nan	nan	nan	nan
nan	4° Déplacements pour motif familial impérieux, pour l'assistance des personnes vulnérables et pour la garde d'enfants ;	nan	nan	nan	nan	nan	nan	nan	nan
nan	Dans les circonscriptions territoriales où l'état d'urgence sanitaire est déclaré, le Premier ministre peut, par décret réglementaire pris sur le rapport du ministre chargé de la santé, aux seules fins de garantir la santé publique : « 3° Ordonner des mesures ayant pour objet la mise en quarantaine, au sens de l'article 1er du règlement sanitaire international de 2005, des personnes susceptibles d'être affectées ;	nan	nan	nan	nan	nan	nan	nan	nan
nan	L'accueil des usagers dans les établissements d'enseignement supérieur mentionnés au livre VII de la troisième partie du code de l'éducation est autorisé aux seules fins de permettre l'accès :	nan	nan	nan	nan	nan	nan	nan	nan
nan	Afin de ralentir la propagation du virus covid-19, les établissements relevant des catégories mentionnées à l'article GN1 de l'arrêté du 25 juin 1980 susvisé figurant ci-après ne peuvent plus accueillir du public jusqu'au 15 avril 2020 :- au titre de la catégorie L : Salles d'auditions, de conférences, de réunions, de spectacles ou à usage multiple	nan	nan	nan	nan	nan	nan	nan	nan
nan	VIII. - Les dispositions du présent VIII s'appliquent au transport de marchandises. Pour la réalisation des opérations de transport de marchandises, le véhicule est équipé d'une réserve d'eau et de savon ainsi que de serviettes à usage unique, ou de gel hydro-alcoolique.Lorsque les lieux de chargement ou de déchargement ne sont pas pourvus d'un point d'eau et de savon, ils sont pourvus de gel hydro-alcoolique. Il ne peut être refusé à un conducteur de véhicules de transport de marchandises l'accès à un lieu de chargement ou de déchargement, y compris à un point d'eau lorsque ce lieu en est pourvu.	nan	nan	nan	nan	nan	nan	nan	nan
