id	text	event1	event2	event3	event4	event5	event6	event7	event8
nan	-Lorsque le Premier ministre ou le ministre chargé de la santé prennent des mesures mentionnées aux articles L. 3131-15 et L. 3131-16, ils peuvent habiliter le représentant de l'Etat territorialement compétent à prendre toutes les mesures générales ou individuelles d'application de ces dispositions.	nan	nan	nan	nan	nan	nan	nan	nan
nan	III. - Les rassemblements, réunions ou activités sur la voie publique ou dans un lieu ouvert au public autres que ceux mentionnés au II mettant en présence de manière simultanée plus de six personnes sont interdits.	nan	nan	nan	nan	nan	nan	nan	nan
nan	Le Conseil constitutionnel a été saisi, le 23 mars 2020, par le Premier ministre, sous le n° 2020-799 DC, conformément au cinquième alinéa de l'article 46 et au premier alinéa de l'article 61 de la Constitution, de la loi organique d'urgence pour faire face à l'épidémie de covid-19.Au vu des textes suivants :- la Constitution ;- l'ordonnance n° 58-1067 du 7 novembre 1958 portant loi organique sur le Conseil constitutionnel ;	nan	nan	nan	nan	nan	nan	nan	nan
nan	Ayant atteint sa pleine capacité opérationnelle quelques jours plus tard, l’EMR dispose alors d’une capacité opérationnelle de 30 lits de réanimation – cinq modules de six lits chacun – et est armé par 121 personnels, dont 91 personnels soignants du SSA et du régiment médical (RMED) de l’armée de terre.	nan	nan	nan	nan	nan	nan	nan	nan
nan	II. - Les données permettant l'identification du téléphone mobile, de son détenteur ou de son utilisateur ne peuvent être collectées ni enregistrées dans le cadre du traitement.	nan	nan	nan	nan	nan	nan	nan	nan
nan	- le domaine de la protection, les militaires de l’opération Résilience pouvant contribuer à la surveillance de sites sensibles, en appui des forces de sécurité intérieure.	nan	nan	nan	nan	nan	nan	nan	nan
nan	« Dans le cadre des mesures de mise en quarantaine, de placement et de maintien en isolement, il peut être fait obligation à la personne qui en fait l'objet de :« 1° Ne pas sortir de son domicile ou du lieu d'hébergement où elle exécute la mesure, sous réserve des déplacements qui lui sont spécifiquement autorisés par l'autorité administrative. Dans le cas où un isolement complet de la personne est prononcé, il lui est garanti un accès aux biens et services de première nécessité ainsi qu'à des moyens de communication téléphonique et électronique lui permettant de communiquer librement avec l'extérieur ;« 2° Ne pas fréquenter certains lieux ou catégories de lieux.	nan	nan	nan	nan	nan	nan	nan	nan
nan	- le domaine logistique, via le transport de fret aérien, maritime ou terrestre, la mise à disposition d’emprise ou d’experts de la logistique au profit des autorités civiles	nan	nan	nan	nan	nan	nan	nan	nan
nan	V. - Le transporteur maritime ou fluvial peut demander au passager de présenter, avant son embarquement, une déclaration sur l'honneur attestant qu'il ne présente pas de symptôme d'infection au covid-19. A défaut, l'accès peut lui être refusé et il peut être reconduit à l'extérieur des espaces concernés.	nan	nan	nan	nan	nan	nan	nan	nan
nan	Lorsque le délai prévu des mesures de placements ordonnés en application de l'ordonnance n° 45-174 du 2 février 1945 relative à l'enfance délinquante arrive à échéance, le juge des enfants peut, au vu du rapport du service éducatif, d'office et sans audition des parties, proroger ce délai pour une durée qui ne peut excéder quatre mois. Les parents, le mineur et le procureur de la République sont informés de cette prorogation.	nan	nan	nan	nan	nan	nan	nan	nan
nan	ReplierChapitre III : Dispositions relatives à l'outre-mer (Articles 12 à 13)Article 12I.-Le livre VIII de la troisième partie du code de la santé publique est ainsi modifié :1° L'article L. 3821-11 est ainsi modifié :a) Au premier alinéa, la référence : « n° 2020-290 du 23 mars 2020 d'urgence pour faire face à l'épidémie de covid-19 » est remplacée par la référence : « n° 2020-546 du 11 mai 2020 prorogeant l'état d'urgence sanitaire et complétant ses dispositions » ;b) Le premier alinéa du 3° est ainsi rédigé :« 3° Le I de l'article L. 3131-17 est complété par un alinéa ainsi rédigé : » ;c) Le 4° est ainsi rédigé :« 4° Les sixième et septième alinéas de l'article L. 3136-1 ne sont pas applicables ; »2° Le chapitre Ier du titre IV est ainsi modifié :a) L'article L. 3841-2 est ainsi modifié :-au premier alinéa, après le mot : « française », sont insérés les mots : « dans sa rédaction résultant de la loi n° 2020-546 du 11 mai 2020 prorogeant l'état d'urgence sanitaire et complétant ses dispositions » ;-au premier alinéa du 2°, après la référence : « premier alinéa », est insérée la référence : « du I » ;-au dernier alinéa du même 2°, les références : « 1° à 9° » sont remplacées par les références : « 1°, 2° et 5° à 9° du I » ;	nan	nan	nan	nan	nan	nan	nan	nan
nan	4° Aux services administratifs, notamment ceux chargés des inscriptions, uniquement sur rendez-vous ou sur convocation de l'établissement ;	nan	nan	nan	nan	nan	nan	nan	nan
nan	- établissements de type CTS : Chapiteaux, tentes et structures ;	nan	nan	nan	nan	nan	nan	nan	nan
nan	Pour l'application de l'article 1er, les gérants des établissements mentionnés au I organisent l'accueil du public dans les conditions suivantes :1° Les personnes accueillies ont une place assise ;	nan	nan	nan	nan	nan	nan	nan	nan
nan	2° Les défunts atteints ou probablement atteints du covid-19 au moment de leur décès font l'objet d'une mise en bière immédiate. La pratique de la toilette mortuaire est interdite pour ces défunts, à l'exclusion des soins réalisés post-mortem par des professionnels de santé ou des thanatopracteurs. Les soins et la toilette qui ne sont pas interdits par le présent article sont pratiqués dans des conditions sanitaires appropriées.	nan	nan	nan	nan	nan	nan	nan	nan
nan	- établissements de type N : Restaurants et débits de boissons, sauf pour leurs activités de livraison et de vente à emporter, le room service des restaurants et bars d'hôtels et la restauration collective sous contrat ;	nan	nan	nan	nan	nan	nan	nan	nan
nan	Afin de ralentir la propagation du virus covid-19, tout rassemblement, réunion ou activité mettant en présence de manière simultanée plus de 100 personnes en milieu clos ou ouvert, est interdit sur le territoire de la République jusqu'au 15 avril 2020.	nan	nan	nan	nan	nan	nan	nan	nan
nan	Dans les véhicules routiers comportant plusieurs portes, l'entreprise interdit aux voyageurs d'utiliser la porte avant et leur permet de monter et descendre par toute autre porte. Toutefois l'utilisation de la porte avant est autorisée lorsque sont prises les dispositions permettant de séparer le conducteur des voyageurs d'une distance au moins égale à un mètre.	nan	nan	nan	nan	nan	nan	nan	nan
nan	Pour l'année 2020, les durées mentionnées aux articles L. 611-1, L. 621-4, L. 631-6 et L. 641-8 du code des procédures civiles d'exécution sont augmentées de deux mois.	nan	nan	nan	nan	nan	nan	nan	nan
nan	5° Déplacements résultant d'une obligation de présentation aux services de police ou de gendarmerie nationales ou à tout autre service ou professionnel, imposée par l'autorité de police administrative ou l'autorité judiciaire ;6° Déplacements résultant d'une convocation émanant d'une juridiction administrative ou de l'autorité judiciaire ;7° Déplacements aux seules fins de participer à des missions d'intérêt général sur demande de l'autorité administrative et dans les conditions qu'elle précise.	nan	nan	nan	nan	nan	nan	nan	nan
nan	Afin de ralentir la propagation du virus, les mesures d'hygiène et de distanciation sociale, dites « barrières », définies au niveau national, doivent être observées en tout lieu et en toute circonstance. Les rassemblements, réunions, activités, accueils et déplacements ainsi que l'usage des moyens de transports qui ne sont pas interdits en vertu du présent décret sont organisés en veillant au strict respect de ces mesures.	nan	nan	nan	nan	nan	nan	nan	nan
nan	Par dérogation aux dispositions du I et sans préjudice de l'article L. 211-3 du code de la sécurité intérieure, les cortèges, défilés et rassemblement de personnes, et, d'une façon générale, toutes les manifestations sur la voie publique mentionnés au premier alinéa de l'article L. 211-1 du même code sont autorisés par le préfet de département si les conditions de leur organisation sont propres à garantir le respect des dispositions de l'article 1er du présent décret.	nan	nan	nan	nan	nan	nan	nan	nan
nan	les forces ont apporté un soutien déterminant aux autorités civiles sur le terrain, depuis les bases militaires, par des actions locales adaptées aux besoins exprimés par les préfets et les agences régionales de santé, allant de la mise en place d’un sas à l’entrée d’un établissement d’hébergement pour personnes âgées dépendantes (EHPAD) à la sécurisation de site.	nan	nan	nan	nan	nan	nan	nan	nan
nan	Les personnes de onze ans ou plus souhaitant se déplacer par transport public aérien à destination de l'une des collectivités mentionnées à l'article 72-3 de la Constitution présentent le résultat d'un examen biologique de dépistage virologique réalisé moins de 72 heures avant le vol ne concluant pas à une contamination par le covid-19.	nan	nan	nan	nan	nan	nan	nan	nan
nan	Considérant qu'eu égard à sa propagation sur le territoire national, telle qu'elle ressort des données scientifiques disponibles qui seront rendues publiques, l'épidémie de covid-19 constitue une catastrophe sanitaire mettant en péril, par sa nature et sa gravité, la santé de la population, justifiant que l'état d'urgence sanitaire soit déclaré afin que les mesures strictement proportionnées aux risques sanitaires encourus et appropriées aux circonstances de temps et de lieu puissent être prises ;	nan	nan	nan	nan	nan	nan	nan	nan
nan	4° Déplacements pour motif familial impérieux, pour l'assistance des personnes vulnérables, pour le répit et l'accompagnement des personnes handicapées et pour la garde d'enfants ;	nan	nan	nan	nan	nan	nan	nan	nan
nan	le domaine sanitaire, grâce à l’action du service de santé des armées pour accueillir des patients au sein des hôpitaux d’instruction des armées (HIA) et de l’hôpital de campagne de Mulhouse et conduire des opérations de désengorgement des zones les plus touchées par les moyens des trois armées ;	nan	nan	nan	nan	nan	nan	nan	nan
nan	ReplierChapitre 2 : Dispositions concernant les déplacements et les transports (Articles 3 à 6)Article 3I. - Tout déplacement de personne la conduisant à la fois à sortir d'un périmètre défini par un rayon de 100 kilomètres de son lieu de résidence et à sortir du département dans lequel ce dernier est situé est interdit à l'exception des déplacements pour les motifs suivants :1° Trajets entre le lieu de résidence et le ou les lieux d'exercice de l'activité professionnelle, et déplacements professionnels insusceptibles d'être différés ;	nan	nan	nan	nan	nan	nan	nan	nan
nan	Fait le 14 avril 2020.Edouard PhilippePar le Premier ministre :Le ministre des solidarités et de la santé,Olivier VéranLa ministre des outre-mer,Annick Girardin	nan	nan	nan	nan	nan	nan	nan	nan
nan	Par dérogation à l'article 1er de la loi organique n° 83-499 du 17 juin 1983 relative à la représentation au Sénat des Français établis hors de France, le mandat des six sénateurs représentant les Français établis hors de France élus en septembre 2014 est prolongé jusqu'au 30 septembre 2021.	nan	nan	nan	nan	nan	nan	nan	nan
nan	Par dérogation aux règles de publicité définies par les articles 306 et 400 du code de procédure pénale, le président de la juridiction peut décider, avant l'ouverture de l'audience, que les débats se dérouleront en publicité restreinte, ou, en cas d'impossibilité de garantir les conditions nécessaires à la protection de la santé des personnes présentes à l'audience, à huis clos. Dans les conditions déterminées par le président, des journalistes peuvent assister à l'audience, y compris lorsque le huis clos a été ordonné en application des dispositions du présent article.	nan	nan	nan	nan	nan	nan	nan	nan
nan	Eu égard à la situation sanitaire, dans le cadre d'un traitement chronique, à titre exceptionnel, lorsque la durée de validité d'une ordonnance renouvelable est expirée et afin d'éviter toute interruption de traitement préjudiciable à la santé du patient, les pharmacies d'officine peuvent dispenser, dans le cadre de la posologie initialement prévue, un nombre de boîtes par ligne d'ordonnance garantissant la poursuite du traitement jusqu'au 31 mai 2020.	nan	nan	nan	nan	nan	nan	nan	nan
nan	I. - Les établissements relevant des catégories mentionnées par le règlement pris en application de l'article R. 123-12 du code de la construction et de l'habitation figurant ci-après ne peuvent accueillir du public :1° Etablissements de type N : Restaurants et débits de boisson ;	nan	nan	nan	nan	nan	nan	nan	nan
nan	- établissements de type P : Salles de danse et salles de jeux ;	nan	nan	nan	nan	nan	nan	nan	nan
nan	Par dérogation aux dispositions de la loi du 22 juillet 2013 susvisée :1° La déclaration de candidature pour chaque candidat ou liste de candidats est déposée auprès de l'ambassade ou du poste consulaire du chef-lieu de la circonscription électorale, au plus tard le trentième jour précédant la date du scrutin, à 18 heures.	nan	nan	nan	nan	nan	nan	nan	nan
nan	3° L'orientation des personnes infectées, et des personnes susceptibles de l'être, en fonction de leur situation, vers des prescriptions médicales d'isolement prophylactiques, ainsi que l'accompagnement de ces personnes pendant et après la fin de ces mesures ;	nan	nan	nan	nan	nan	nan	nan	nan
nan	Afin de prévenir la propagation du virus covid-19, tout rassemblement, réunion ou activité mettant en présence de manière simultanée plus de 100 personnes en milieu clos ou ouvert, est interdit sur le territoire métropolitain de la République jusqu'au 15 avril 2020.	nan	nan	nan	nan	nan	nan	nan	nan
nan	2° Après l'article 16, il est inséré un article 16-1 ainsi rédigé :« Art. 16-1.-A compter du 11 mai 2020, la prolongation de plein droit des délais de détention provisoire prévue à l'article 16 n'est plus applicable aux titres de détention dont l'échéance intervient à compter de cette date et les détentions ne peuvent être prolongées que par une décision de la juridiction compétente prise après un débat contradictoire intervenant, le cas échéant, selon les modalités prévues à l'article 19.« Si l'échéance du titre de détention en cours, résultant des règles de droit commun du code de procédure pénale, intervient avant le 11 juin 2020, la juridiction compétente dispose d'un délai d'un mois à compter de cette échéance pour se prononcer sur sa prolongation, sans qu'il en résulte la mise en liberté de la personne, dont le titre de détention est prorogé jusqu'à cette décision. Cette prorogation s'impute sur la durée de la prolongation décidée par la juridiction. En ce qui concerne les délais de détention au cours de l'instruction, cette durée est celle prévue par les dispositions de droit commun ; toutefois, s'il s'agit de la dernière échéance possible, la prolongation peut être ordonnée selon les cas pour les durées prévues à l'article 16 de la présente ordonnance.« En ce qui concerne les délais d'audiencement, la prolongation peut être ordonnée pour les durées prévues au même article 16, y compris si elle intervient après le 11 juin 2020.« La prolongation de plein droit du délai de détention intervenue au cours de l'instruction avant le 11 mai 2020, en application dudit article 16, n'a pas pour effet d'allonger la durée maximale totale de la détention en application des dispositions du code de procédure pénale, sauf si cette prolongation a porté sur la dernière échéance possible.« Lorsque la détention provisoire au cours de l'instruction a été prolongée de plein droit en application de l'article 16 de la présente ordonnance pour une durée de six mois, cette prolongation ne peut maintenir ses effets jusqu'à son terme que par une décision prise par le juge des libertés et de la détention selon les modalités prévues à l'article 145 du code de procédure pénale et, le cas échéant, à l'article 19 de la présente ordonnance. La décision doit intervenir au moins trois mois avant le terme de la prolongation. Si une décision de prolongation n'intervient pas avant cette date, la personne est remise en liberté si elle n'est pas détenue pour une autre cause.« Pour les délais de détention en matière d'audiencement, la prolongation de plein droit des délais de détention ou celle décidée en application du troisième alinéa du présent article a pour effet d'allonger la durée maximale totale de la détention possible jusqu'à la date de l'audience prévue en application des dispositions du code de procédure pénale.« Les dispositions du présent article sont applicables aux assignations à résidence sous surveillance électronique. » ;	nan	nan	nan	nan	nan	nan	nan	nan
nan	Les résidences de tourisme	nan	nan	nan	nan	nan	nan	nan	nan
nan	Le préfet de département ou, pour l'Ile-de-France, le préfet de la région Ile-de-France, est habilité à réserver, à certaines heures, eu égard aux conditions d'affluence constatées ou prévisibles, l'accès aux espaces et véhicules de transport public collectif de voyageurs, ainsi qu'aux quais des tramways et aux espaces situés à proximité des points d'arrêts desservis par les véhicules de transport routier collectifs de voyageurs, aux seules personnes effectuant un déplacement pour les motifs suivants :	nan	nan	nan	nan	nan	nan	nan	nan
nan	2° A l'annexe de l'article 8, après les mots : « Hôtels et hébergement similaires », sont ajoutés les mots : « à l'exclusion des villages vacances, maisons familiales et auberges collectives » ;	nan	nan	nan	nan	nan	nan	nan	nan
nan	Le ministre des solidarités et de la santé est chargé de l'exécution du présent décret, qui sera publié au Journal officiel de la République française et entrera en vigueur immédiatement.Fait le 27 mars 2020.	nan	nan	nan	nan	nan	nan	nan	nan
nan	Le décret du 23 mars 2020 susvisé est ainsi modifié : 2° A l'annexe de l'article 8, après les mots : « Hôtels et hébergement similaires », sont ajoutés les mots : « à l'exclusion des villages vacances, maisons familiales et auberges collectives » ;	nan	nan	nan	nan	nan	nan	nan	nan
nan	2° Toutefois, les établissements mentionnés au 1° peuvent accueillir du public pour l'organisation d'épreuves de concours ou d'examens dans des conditions de nature à permettre le respect des dispositions de l'article 1er.	nan	nan	nan	nan	nan	nan	nan	nan
nan	L'état d'urgence sanitaire est déclaré à compter du 17 octobre 2020 à 0 heure sur l'ensemble du territoire de la République.	nan	nan	nan	nan	nan	nan	nan	nan
nan	le préfet territorialement compétent : est habilité à prescrire la mise en quarantaine ou le placement et le maintien en isolement :a) Des personnes ne pouvant justifier, à leur arrivée, du résultat d'un examen biologique de dépistage virologique réalisé moins de 72 heures avant le vol ne concluant pas à une contamination par le covid-19 ;	nan	nan	nan	nan	nan	nan	nan	nan
nan	Dans les circonscriptions territoriales où l'état d'urgence sanitaire est déclaré, le ministre chargé de la santé peut prescrire, par arrêté motivé, toute mesure réglementaire relative à l'organisation et au fonctionnement du dispositif de santé, à l'exception des mesures prévues à l'article L. 3131-15, visant à mettre fin à la catastrophe sanitaire mentionnée à l'article L. 3131-12.	nan	nan	nan	nan	nan	nan	nan	nan
nan	Les dispositions de la présente ordonnance sont applicables sur l'ensemble du territoire de la République jusqu'à l'expiration d'un délai d'un mois à compter de la date de cessation de l'état d'urgence sanitaire déclaré dans les conditions de l'article 4 de la loi du 23 mars 2020.	nan	nan	nan	nan	nan	nan	nan	nan
nan	Les conseillers municipaux et communautaires élus dès le premier tour organisé le 15 mars 2020 entrent en fonction à une date fixée par décret au plus tard au mois de juin 2020, aussitôt que la situation sanitaire le permet au regard de l’analyse du comité de scientifiques. La première réunion du conseil municipal se tient de plein droit au plus tôt cinq jours et au plus tard dix jours après cette entrée en fonction.	nan	nan	nan	nan	nan	nan	nan	nan
nan	La loi organique d'urgence pour faire face à l'épidémie de covid-19 est conforme à la Constitution.	nan	nan	nan	nan	nan	nan	nan	nan
nan	Les marchés ouverts ou couverts ne peuvent accueillir du public que dans le respect des conditions prévues au présent article.	nan	nan	nan	nan	nan	nan	nan	nan
nan	V. - Tout opérateur de transport public collectif de voyageurs routier par autocar ou autobus, ou guidé ou ferroviaire, communique aux voyageurs, par annonce sonore et par affichage dans les espaces accessibles au public et affectés au transport public de voyageurs et à bord de chaque véhicule ou matériel roulant, les mesures d'hygiène et de distanciation sociale dites « barrières ». L'opérateur permet l'accès à un point d'eau et de savon ou à un distributeur de gel hydro-alcoolique pour les voyageurs.	nan	nan	nan	nan	nan	nan	nan	nan
nan	- Le préfet de département est habilité, si l'afflux de patients ou de victimes ou la situation sanitaire le justifie, à ordonner, par des mesures générales ou individuelles, la réquisition nécessaire de tout établissement de santé ou établissement médico-social ainsi que de tout bien, service ou personne nécessaire au fonctionnement de ces établissements, notamment des professionnels de santé.	nan	nan	nan	nan	nan	nan	nan	nan
nan	ARTICLE 1 Le z= paragraphe de l'article 6 du titre V de l'arrêté municipal bruit n°2019-0456 du 15 mars 2019, portant sur « Habitat-Bruits de comportement et travaux de bricolage, de jardinage et de mécanique» est remplacé par: « A cet effet, les travaux de bricolage ou de jardinage avec utilisation des appareils bruyants gênant le voisinage en raison de leur intensité sonore ou de leur durée, tels qu'appareils à moteur thermique (tondeuse à gazon, motoculteur, tronçonneuse ... ), engins bruyants provoquant par leur utilisation des percussions (perceuse ... ), vibrations, trépidations et bruits de toute nature sont interdits endehors des jours et horaires suivants : - Du lundi au vendredi de 10h30 à 12h30 et de 16h00 à 18h00 Les samedis de 10h30 à 12h30 Les dimanches et jours fériés, aucun bruit d'engins n'est autorisé.	nan	nan	nan	nan	nan	nan	nan	nan
nan	les mots : « entre 21 heures et 6 heures du matin » sont remplacés par les mots : « au cours d'une plage horaire comprise entre 20 heures et 6 heures du matin, définie par le préfet de département, »	nan	nan	nan	nan	nan	nan	nan	nan
nan	I.-Toute personne âgée de onze ans ou plus entrant par voie terrestre sur le territoire national doit être en mesure de présenter le résultat d'un examen biologique de dépistage virologique réalisé moins de 72 heures avant son départ ne concluant pas à une contamination par le covid-19. Par dérogation, cette obligation ne s'applique pas aux :	nan	nan	nan	nan	nan	nan	nan	nan
nan	I. - Tout passager présente au transporteur aérien, avant son embarquement, outre le document prévu au III de l'article 3, une déclaration sur l'honneur attestant qu'il ne présente pas de symptôme d'infection au covid-19. Sans préjudice des sanctions pénales prévues à l'article L. 3136-1 du code de la santé publique, à défaut de présentation de ces documents, l'embarquement est refusé et le passager est reconduit à l'extérieur des espaces concernés.Le transporteur aérien peut également refuser l'embarquement aux passagers qui ont refusé de se soumettre à un contrôle de température.	nan	nan	nan	nan	nan	nan	nan	nan
nan	- V : Etablissements de cultes ;	nan	nan	nan	nan	nan	nan	nan	nan
nan	Les établissements recevant du public relevant du type R défini par le règlement pris en application de l'article R. 123-12 du code de la construction et de l'habitation figurant ci-après peuvent accueillir du public :1° Etablissements d'éveil, les centres de vacances et les centres de loisirs sans hébergement dans les conditions prévues à l'article 32 ;2° Etablissements d'enseignement dans les conditions prévues aux articles 33 à 35.	nan	nan	nan	nan	nan	nan	nan	nan
nan	le Premier ministre peut, par décret réglementaire pris sur le rapport du ministre chargé de la santé, aux seules fins de garantir la santé publique : « 7° Ordonner la réquisition de tous biens et services nécessaires à la lutte contre la catastrophe sanitaire ainsi que de toute personne nécessaire au fonctionnement de ces services ou à l'usage de ces biens. L'indemnisation de ces réquisitions est régie par le code de la défense ;	nan	nan	nan	nan	nan	nan	nan	nan
nan	ne peuvent plus accueillir du public jusqu'au 15 avril 2020 : au titre de la catégorie M : Magasins de vente et Centres commerciaux, sauf pour leurs activités de livraison et de retraits de commandes	nan	nan	nan	nan	nan	nan	nan	nan
