id	text	event1	event2	event3	event4	event5	event6	event7	event8
nan	ne peuvent plus accueillir du public jusqu'au 15 avril 2020 : - au titre de la catégorie N : Restaurants et débits de boissons, sauf pour leurs activités de livraison et de vente à emporter, le « room service » des restaurants et bars d'hôtels et la restauration collective sous contrat ;	nan	nan	nan	nan	nan	nan	nan	nan
nan	« Les mesures de mise en quarantaine, de placement et de maintien en isolement peuvent se dérouler, au choix des personnes qui en font l'objet, à leur domicile ou dans les lieux d'hébergement adapté.« Leur durée initiale ne peut excéder quatorze jours. Les mesures peuvent être renouvelées, dans les conditions prévues au III de l'article L. 3131-17 du présent code, dans la limite d'une durée maximale d'un mois. Il est mis fin aux mesures de placement et de maintien en isolement avant leur terme lorsque l'état de santé de l'intéressé le permet.	nan	nan	nan	nan	nan	nan	nan	nan
nan	Dans les territoires où l'état d'urgence sanitaire est en vigueur, les établissements recevant du public relevant des types suivants définis par le règlement pris en application de l'article R. 123-12 du code de la construction et de l'habitation ne peuvent accueillir de public :	nan	nan	nan	nan	nan	nan	nan	nan
nan	III. - L'application StopCovid est installée librement et gratuitement par les utilisateurs. Ceux-ci ont la faculté d'activer ou non la fonctionnalité de l'application permettant de constituer l'historique de proximité mentionné au 5° du I de l'article 2. En cas de diagnostic clinique positif au virus du covid-19 ou de résultat positif à un examen de dépistage à ce virus, les utilisateurs de l'application sont libres de notifier ou non ce résultat dans l'application et de transmettre au serveur l'historique de proximité mentionné au 6° du I de l'article 2. L'application peut être désinstallée à tout moment.	nan	nan	nan	nan	nan	nan	nan	nan
nan	Au premier alinéa du I de l'article 11 de la loi n° 2020-546 du 11 mai 2020 prorogeant l'état d'urgence sanitaire et complétant ses dispositions, la date : « 1er avril 2021 » est remplacée par la date : « 31 décembre 2021 ».	nan	nan	nan	nan	nan	nan	nan	nan
nan	ReplierChapitre II : Dispositions relatives à la création d'un système d'information aux seules fins de lutter contre l'épidémie de covid-19 (Article 11)	nan	nan	nan	nan	nan	nan	nan	nan
nan	II.-Par dérogation, les établissements mentionnés au 1° du I peuvent continuer à accueillir du public pour :	nan	nan	nan	nan	nan	nan	nan	nan
nan	Tout déplacement de personne hors de son lieu de résidence est interdit entre 20 heures et 6 heures du matin à l'exception des déplacements pour les motifs suivants, en évitant tout regroupement de personnes :	nan	nan	nan	nan	nan	nan	nan	nan
nan	Par dérogation au I, restent autorisés les déplacements justifiés par l'un des motifs suivants :- motif impérieux d'ordre personnel ou familial ;- motif de santé relevant de l'urgence ;- motif professionnel ne pouvant être différé.	nan	nan	nan	nan	nan	nan	nan	nan
nan	Article 7Tout rassemblement, réunion ou activité mettant en présence de manière simultanée plus de 100 personnes en milieu clos ou ouvert, est interdit sur le territoire de la République jusqu'au 15 avril 2020.	nan	nan	nan	nan	nan	nan	nan	nan
nan	4. Conformément au premier alinéa de l'article 61-1 de la Constitution, les articles 23-4 et 23-5 de l'ordonnance du 7 novembre 1958 mentionnée ci-dessus fixent à trois mois le délai déterminé dans lequel le Conseil d'Etat ou la Cour de cassation doit se prononcer sur le renvoi d'une question prioritaire de constitutionnalité au Conseil constitutionnel. L'article 23-10 de la même ordonnance prévoit que le Conseil constitutionnel statue dans un même délai de trois mois après sa saisine.	nan	nan	nan	nan	nan	nan	nan	nan
nan	« Les mesures prescrites en application des 1° à 10° du présent article sont strictement proportionnées aux risques sanitaires encourus et appropriées aux circonstances de temps et de lieu. Il y est mis fin sans délai lorsqu'elles ne sont plus nécessaires.	nan	nan	nan	nan	nan	nan	nan	nan
nan	- établissements de type N : Restaurants et débits de boissons, sauf pour leurs activités de livraison et de vente à emporter, le room service des restaurants et bars d'hôtels et la restauration collective sous contrat ;	nan	nan	nan	nan	nan	nan	nan	nan
nan	TITRE III DISPOSITIONS ÉLECTORALES Article 19 I. – Lorsque, à la suite du premier tour organisé le 15 mars 2020 pour l’élection des conseillers municipaux et communautaires, des conseillers de Paris et des conseillers métropolitains de Lyon, un second tour est nécessaire pour attribuer les sièges qui n’ont pas été pourvus, ce second tour, initialement fixé au 22 mars 2020, est reporté au plus tard en juin 2020, en raison des circonstances exceptionnelles liées à l’impérative protection de la population face à l’épidémie de covid-19. Sa date est fixée par décret en conseil des ministres, pris le mercredi 27 mai 2020 au plus tard si la situation sanitaire permet l’organisation des opérations électorales au regard, notamment, de l’analyse du comité de scientifiques institué sur le fondement de l’article L. 3131-19 du code de la santé publique.	nan	nan	nan	nan	nan	nan	nan	nan
nan	3° Entre ces collectivités.	nan	nan	nan	nan	nan	nan	nan	nan
nan	Les rassemblements, réunions ou activités indispensables à la continuité de la vie de la Nation peuvent être maintenus à titre dérogatoire par le représentant de l'Etat dans le département, par des mesures réglementaires ou individuelles, sauf lorsque les circonstances locales s'y opposent.	nan	nan	nan	nan	nan	nan	nan	nan
nan	III.-L'ordonnance n° 2020-303 du 25 mars 2020 portant adaptation de règles de procédure pénale sur le fondement de la loi n° 2020-290 du 23 mars 2020 d'urgence pour faire face à l'épidémie de covid-19 est ainsi modifiée :1° L'avant-dernier alinéa de l'article 4 est complété par une phrase ainsi rédigée : « Lorsque la détention provisoire d'une personne a été ordonnée ou prolongée sur le motif prévu au 5° et, le cas échéant, aux 4° et 7° de l'article 144 du même code, l'avocat de la personne mise en examen peut également adresser par courrier électronique au juge d'instruction une demande de mise en liberté si celle-ci est motivée par l'existence de nouvelles garanties de représentation de la personne ; dans les autres cas, toute demande de mise en liberté formée par courrier électronique est irrecevable ; cette irrecevabilité est constatée par le juge d'instruction qui en informe par courrier électronique l'avocat et elle n'est pas susceptible d'appel devant la chambre de l'instruction. » ;	nan	nan	nan	nan	nan	nan	nan	nan
nan	I. - Sont interdits, sauf s'ils sont fondés sur un motif impérieux d'ordre personnel ou familial, un motif de santé relevant de l'urgence ou un motif professionnel ne pouvant être différé, les déplacements de personnes par transport public aérien entre, d'une part, la Polynésie française, la Nouvelle-Calédonie ou Wallis et Futuna et, d'autre part, tout point du territoire de la République.	nan	nan	nan	nan	nan	nan	nan	nan
nan	I. - Afin de ralentir la propagation du virus, les mesures d'hygiène définies en annexe 1 au présent décret et de distanciation sociale, incluant la distanciation physique d'au moins un mètre entre deux personnes, dites « barrières », définies au niveau national, doivent être observées en tout lieu et en toute circonstance.	nan	nan	nan	nan	nan	nan	nan	nan
nan	« Lorsque la mesure interdit toute sortie de l'intéressé hors du lieu où la quarantaine ou l'isolement se déroule, elle ne peut se poursuivre au-delà d'un délai de quatorze jours sans que le juge des libertés et de la détention, préalablement saisi par le représentant de l'Etat dans le département, ait autorisé cette prolongation.« Un décret en Conseil d'Etat précise les conditions d'application du présent II. Ce décret définit les modalités de la transmission au préfet du certificat médical prévu au deuxième alinéa du présent II. Il précise également les conditions d'information régulière de la personne qui fait l'objet de ces mesures. » ;4° Au début du dernier alinéa, est ajoutée la mention : « III.-».	nan	nan	nan	nan	nan	nan	nan	nan
nan	II. - Les organisateurs des rassemblements, réunions ou activités mentionnés au I mettant en présence de manière simultanée plus de dix personnes adressent au préfet de département sur le territoire duquel la manifestation doit avoir lieu, sans préjudice des autres formalités applicables, une déclaration contenant les mentions prévues à l'article L. 211-2 du code de la sécurité intérieure, en y précisant, en outre, les mesures qu'ils mettent en œuvre afin de garantir le respect des dispositions de l'article 1er du présent décret.	nan	nan	nan	nan	nan	nan	nan	nan
nan	4° L'article 12-1 est ainsi modifié :a) Les dispositions de l'article sont précédées d'un : « I.-» ;	nan	nan	nan	nan	nan	nan	nan	nan
nan	III. - Toute personne de onze ans ou plus qui accède ou demeure dans les espaces accessibles aux passagers des aérogares, les véhicules réservés aux transferts des passagers ou les aéronefs effectuant du transport public à destination, en provenance ou à l'intérieur du territoire national, porte un masque de protection répondant aux caractéristiques techniques fixées par l'arrêté conjoint des ministres chargés de la santé et du budget mentionné au K bis de l'article 278-0 bis du code général des impôts. Sans préjudice des sanctions pénales prévues à l'article L. 3136-1 du code de la santé publique, l'accès auxdits espaces, véhicules et aéronefs est refusé à toute personne qui ne respecte pas cette obligation et la personne est reconduite à l'extérieur des espaces, véhicules et aéronefs concernés.L'obligation du port du masque pesant sur le passager ne fait pas obstacle à ce qu'il lui soit demandé de le retirer pour la stricte nécessité du contrôle de son identité.	nan	nan	nan	nan	nan	nan	nan	nan
nan	Elle a aussi reposé sur l’engagement des acteurs industriels, en lien avec la direction générale de l’armement (DGA) et l’Agence de l’innovation de défense (AID), qui a permis d’apporter des réponses innovantes à la crise.	nan	nan	nan	nan	nan	nan	nan	nan
nan	Les établissements relevant des catégories mentionnées par le règlement pris en application de l'article R. 123-12 du code de la construction et de l'habitation figurant ci-après ne peuvent plus accueillir du public jusqu'au 15 avril 2020 :- au titre de la catégorie L : Salles d'auditions, de conférences, de réunions, de spectacles ou à usage multiple sauf pour les salles d'audience des juridictions ;	nan	nan	nan	nan	nan	nan	nan	nan
nan	Si la situation sanitaire ne permet pas l’organisation du second tour au plus tard au mois de juin 2020, le mandat des conseillers municipaux et communautaires, des conseillers d’arrondissement, des conseillers de Paris et des conseillers métropolitains concernés est prolongé pour une durée fixée par la loi. Les électeurs sont convoqués par décret pour les deux tours de scrutin, qui ont lieu dans les trente jours qui précèdent l’achèvement des mandats ainsi prolongés.	nan	nan	nan	nan	nan	nan	nan	nan
nan	3. Compte tenu des circonstances particulières de l'espèce, il n'y a pas lieu de juger que cette loi organique a été adoptée en violation des règles de procédure prévues à l'article 46 de la Constitution.	nan	nan	nan	nan	nan	nan	nan	nan
nan	1° Trajets entre le domicile et le ou les lieux d'exercice de l'activité professionnelle et déplacements professionnels insusceptibles d'être différés	nan	nan	nan	nan	nan	nan	nan	nan
nan	Les délais fixés par les dispositions du code de procédure pénale pour l'exercice d'une voie de recours sont doublés sans pouvoir être inférieurs à dix jours.	nan	nan	nan	nan	nan	nan	nan	nan
nan	V. - Pour les vols au départ ou à destination de la Polynésie française et de la Nouvelle-Calédonie, le représentant de l'Etat peut compléter la liste des motifs de nature à justifier les déplacements prévus à l'article 3.	nan	nan	nan	nan	nan	nan	nan	nan
nan	La circulation des personnes et des véhicules est interdite sur l’ensemble du territoire communal, voies de circulation et voies privées ouvertes à la circulation publique après 21h et avant 6h à compter du 22 mars 2020 et jusqu’au 31 mars 2020	nan	nan	nan	nan	nan	nan	nan	nan
nan	Par dérogation à l'article 706-71 du code de procédure pénale, il peut être recouru à un moyen de télécommunication audiovisuelle devant l'ensemble des juridictions pénales, autres que les juridictions criminelles, sans qu'il soit nécessaire de recueillir l'accord des parties.	nan	nan	nan	nan	nan	nan	nan	nan
nan	Les établissements recevant du public relevant du type R défini par le règlement pris en application de l'article R. 123-12 du code de la construction et de l'habitation figurant ci-après ne peuvent accueillir de public	nan	nan	nan	nan	nan	nan	nan	nan
nan	Cette obligation s'applique également à tout conducteur d'un véhicule de transport public de voyageurs et à tout agent employé ou mandaté par un exploitant de service de transport dès lors qu'il est en contact avec le public, sauf s'il est séparé physiquement du public par une paroi fixe ou amovible.	nan	nan	nan	nan	nan	nan	nan	nan
nan	Article 2L'aéroport de Paris-Orly demeure accessible en permanence et sans préavis aux aéronefs d'Etat et aux vols de secours médical d'urgence ou d'évacuation sanitaire.L'aéroport de Paris-Orly demeure accessible à tout vol de transport de passagers ou de fret nécessaire à la gestion de la crise sanitaire, sur demande du ministre chargé de l'aviation civile avec un préavis de 12 heures.	nan	nan	nan	nan	nan	nan	nan	nan
nan	3° Toutefois, le préfet de département peut, après avis du maire, autoriser, l'ouverture, dans des conditions de nature à garantir le respect des dispositions de l'article 1er, des musées, monuments et parcs zoologiques dont la fréquentation habituelle est essentiellement locale et dont la réouverture n'est pas susceptible de provoquer des déplacements significatifs de population.	nan	nan	nan	nan	nan	nan	nan	nan
nan	2. Déposé devant le Sénat, première assemblée saisie, le 18 mars 2020, le projet de loi organique, pour lequel le Gouvernement a engagé la procédure accélérée, a été examiné en séance publique le lendemain.	nan	nan	nan	nan	nan	nan	nan	nan
nan	C. - Interdire les déplacements de personnes hors de leur lieu de résidence à l'exception des déplacements pour les motifs suivants en évitant tout regroupement de personnes :	nan	nan	nan	nan	nan	nan	nan	nan
nan	b) Il est complété par un II et un III ainsi rédigés :« II.-Le représentant de l'Etat dans le département peut procéder à la réquisition des matières premières nécessaires à la fabrication des catégories de masques mentionnées à l'article 12.« III.-Dans la mesure nécessaire à l'acheminement de produits de santé et d'équipements de protection individuelle nécessaires pour faire face à la crise sanitaire, sont réquisitionnés, sur décision du ministre chargé de la santé, les aéronefs civils et les personnes nécessaires à leur fonctionnement. »	nan	nan	nan	nan	nan	nan	nan	nan
nan	V. - Aucun événement réunissant plus de 5 000 personnes ne peut se dérouler sur le territoire de la République jusqu'au 31 août 2020.	nan	nan	nan	nan	nan	nan	nan	nan
nan	- établissements de type Y : Musées ;	nan	nan	nan	nan	nan	nan	nan	nan
nan	VI. - Tout usager de onze ans ou plus du transport scolaire, ainsi que les accompagnateurs présents dans le véhicule, portent un masque de protection répondant aux caractéristiques techniques fixées par l'arrêté conjoint des ministres chargés de la santé et du budget mentionné au K bis de l'article 278-0 bis du code général des impôts. L'accès auxdits véhicules et espaces est refusé à toute personne qui ne respecte pas cette obligation.	nan	nan	nan	nan	nan	nan	nan	nan
nan	« III.-La mise en quarantaine ou le placement et maintien en isolement se déroule, au choix de la personne qui en fait l'objet, à son domicile ou dans un lieu d'hébergement adapté à la mise en œuvre des consignes sanitaires qui lui sont prescrites, en tenant compte de sa situation individuelle et familiale.	nan	nan	nan	nan	nan	nan	nan	nan
nan	En matière correctionnelle, les délais maximums de détention provisoire ou d'assignation à résidence sous surveillance électronique, prévus par les dispositions du code de procédure pénale, qu'il s'agisse des détentions au cours de l'instruction ou des détentions pour l'audiencement devant les juridictions de jugement des affaires concernant des personnes renvoyées à l'issue de l'instruction, sont prolongés plein droit de deux mois lorsque la peine d'emprisonnement encourue est inférieure ou égale à cinq ans et de trois mois dans les autres cas, sans préjudice de la possibilité pour la juridiction compétente d'ordonner à tout moment, d'office, sur demande du ministère public ou sur demande de l'intéressé, la mainlevée de la mesure, le cas échéant avec assignation à résidence sous surveillance électronique ou sous contrôle judiciaire lorsqu'il est mis fin à une détention provisoire. Ce délai est porté à six mois en matière criminelle et, en matière correctionnelle, pour l'audiencement des affaires devant la cour d'appel.	nan	nan	nan	nan	nan	nan	nan	nan
nan	Toute personne arrivant en France en provenance du Royaume-Uni présente, à l'entreprise de transport, avant son embarquement :	nan	nan	nan	nan	nan	nan	nan	nan
nan	L'obligation du port du masque pesant sur le passager ne fait pas obstacle à ce qu'il lui soit demandé de le retirer pour la stricte nécessité du contrôle de son identité.	nan	nan	nan	nan	nan	nan	nan	nan
nan	L'article L. 3131-15 du code de la santé publique est ainsi modifié :1° Au début du premier alinéa, est ajoutée la mention : « I.-» ;2° Le 1° est ainsi rédigé :« 1° Réglementer ou interdire la circulation des personnes et des véhicules et réglementer l'accès aux moyens de transport et les conditions de leur usage ; »3° Le 5° est ainsi rédigé :« 5° Ordonner la fermeture provisoire et réglementer l'ouverture, y compris les conditions d'accès et de présence, d'une ou plusieurs catégories d'établissements recevant du public ainsi que des lieux de réunion, en garantissant l'accès des personnes aux biens et services de première nécessité ; »4° La première phrase du 7° est ainsi rédigée : « Ordonner la réquisition de toute personne et de tous biens et services nécessaires à la lutte contre la catastrophe sanitaire. » ;5° Après le 10°, il est inséré un II ainsi rédigé :« II.-Les mesures prévues aux 3° et 4° du I du présent article ayant pour objet la mise en quarantaine, le placement et le maintien en isolement ne peuvent viser que les personnes qui, ayant séjourné au cours du mois précédent dans une zone de circulation de l'infection, entrent sur le territoire national, arrivent en Corse ou dans l'une des collectivités mentionnées à l'article 72-3 de la Constitution. La liste des zones de circulation de l'infection est fixée par arrêté du ministre chargé de la santé. Elle fait l'objet d'une information publique régulière pendant toute la durée de l'état d'urgence sanitaire.	nan	nan	nan	nan	nan	nan	nan	nan
nan	III. - Les rassemblements, réunions ou activités mentionnés au I et qui sont indispensables à la continuité de la vie de la Nation peuvent être maintenus à titre dérogatoire par le préfet de département, par des mesures réglementaires ou individuelles, sauf lorsque les circonstances locales s'y opposent.	nan	nan	nan	nan	nan	nan	nan	nan
nan	Largement méconnu, le service de santé des armées a été placé sur le devant la scène en raison du déploiement de l’EMR au pied de l’hôpital Émile Muller de Mulhouse.	nan	nan	nan	nan	nan	nan	nan	nan
nan	2° Une même table ne peut regrouper que des personnes venant ensemble ou ayant réservé ensemble, dans la limite de dix personnes ;	nan	nan	nan	nan	nan	nan	nan	nan
nan	Dans les départements où l'état d'urgence sanitaire est en vigueur, le préfet de département peut, après avis du maire, interdire l'ouverture d'un centre commercial comprenant un ou plusieurs bâtiments dont la surface commerciale utile cumulée est supérieure ou égale à 70 000 m2 et qui, du fait de son implantation dans un bassin de vie fortement peuplé et de sa proximité immédiate avec une gare desservie par plusieurs lignes de transport ferroviaire ou guidé et de transport public régulier de personnes routier, favorise des déplacements significatifs de population.	nan	nan	nan	nan	nan	nan	nan	nan
nan	2° Les plages, plans d'eau et lacs ainsi que les centres d'activités nautiques.	nan	nan	nan	nan	nan	nan	nan	nan
nan	L'accueil des usagers dans les établissements d'enseignement relevant du livre IV de la deuxième partie du code de l'éducation ainsi que dans les services d'hébergement, d'accueil et d'activités périscolaires qui y sont associés, est assuré dans les conditions fixées par l'article 36.	nan	nan	nan	nan	nan	nan	nan	nan
nan	VI. - Les dispositions du présent article sont applicables dans les îles Wallis et Futuna, en Polynésie française et, dans le cadre des compétences exercées par l'Etat, en Nouvelle-Calédonie.	nan	nan	nan	nan	nan	nan	nan	nan
nan	Il peut être mis fin à l'état d'urgence sanitaire par décret en conseil des ministres avant l'expiration du délai fixé par la loi le prorogeant.	nan	nan	nan	nan	nan	nan	nan	nan
nan	b) Le premier alinéa de l'article L. 3131-1 est complété par une phrase ainsi rédigée : « Le ministre peut également prendre de telles mesures après la fin de l'état d'urgence sanitaire prévu au chapitre Ier bis du présent titre, afin d'assurer la disparition durable de la situation de crise sanitaire. » ;	nan	nan	nan	nan	nan	nan	nan	nan
nan	En ce sens, la raison d’être du SSA n’est pas, et n’a jamais été, de répondre à des problématiques de santé publique sur le territoire national. Comptant 2 000 médecins, 6 500 infirmiers et 3 100 réservistes, il n’en aurait de toute façon pas les moyens.	nan	nan	nan	nan	nan	nan	nan	nan
nan	e décret crée un traitement de données à caractère personnel, nécessaire au fonctionnement de l'application mobile de suivi de contacts dénommée « StopCovid », qui permet à ses utilisateurs d'être informés lorsqu'ils ont été à proximité d'au moins un autre utilisateur diagnostiqué ou dépisté positif au virus du covid-19, grâce à la conservation de l'historique de proximité des pseudonymes émis via la technologie Bluetooth. Le téléchargement et l'utilisation de l'application sont libres et gratuits. Le décret détermine les finalités du traitement de données à caractère personnel mis en œuvre, ainsi que les catégories de données enregistrées, les destinataires de ces données, leur durée de conservation et les modalités d'exercice, par les personnes concernées, des droits qui leur sont reconnus par le règlement (UE) 2016/679 du 27 avril 2016 (RGPD).	nan	nan	nan	nan	nan	nan	nan	nan
nan	ne peuvent plus accueillir du public jusqu'au 15 avril 2020 : - au titre de la catégorie PA : Etablissements de plein air ;	nan	nan	nan	nan	nan	nan	nan	nan
nan	Les personnes de onze ans ou plus arrivant sur le territoire métropolitain par transport public aérien depuis un pays étranger mentionné sur la liste figurant en annexe 2 ter qui ne peuvent présenter le résultat d'un examen biologique de dépistage virologique réalisé moins de 72 heures avant le vol ne concluant pas à une contamination par le covid-19 sont dirigées à leur arrivée à l'aéroport vers un poste de contrôle sanitaire permettant la réalisation d'un tel examen.	nan	nan	nan	nan	nan	nan	nan	nan
nan	Les délais de prescription de l'action publique et de prescription de la peine sont suspendus à compter du 12 mars 2020 jusqu'au terme prévu à l'article 2.	nan	nan	nan	nan	nan	nan	nan	nan
nan	L'état d'urgence sanitaire peut être déclaré sur tout ou partie du territoire métropolitain ainsi que du territoire des collectivités régies par les articles 73 et 74 de la Constitution et de la Nouvelle-Calédonie en cas de catastrophe sanitaire mettant en péril, par sa nature et sa gravité, la santé de la population.	nan	nan	nan	nan	nan	nan	nan	nan
nan	6° Déplacements résultant d'une obligation de présentation aux services de police ou de gendarmerie nationales ou à tout autre service ou professionnel, imposée par l'autorité de police administrative ou l'autorité judiciaire ;	nan	nan	nan	nan	nan	nan	nan	nan
nan	Article 3Le traitement est mis en œuvre pour une durée ne pouvant excéder six mois après la cessation de l'état d'urgence sanitaire déclaré par l'article 4 de la loi n° 2020-290 du 23 mars 2020 susvisée.	nan	nan	nan	nan	nan	nan	nan	nan
nan	Les villages résidentiels de tourisme	nan	nan	nan	nan	nan	nan	nan	nan
