id	text	event1	event2	event3	event4	event5	event6	event7	event8
nan	Les règles de procédure pénale sont adaptées conformément aux dispositions de la présente ordonnance, afin de permettre la continuité de l'activité des juridictions pénales essentielle au maintien de l'ordre public.	nan	nan	nan	nan	nan	nan	nan	nan
nan	ne peuvent plus accueillir du public jusqu'au 15 avril 2020 :- au titre de la catégorie R : Etablissements d'éveil, d'enseignement, de formation, centres de vacances, centres de loisirs sans hébergement, sauf ceux relevant des articles 9 et 10.	nan	nan	nan	nan	nan	nan	nan	nan
nan	Dans les départements mentionnés à l'annexe 2, le préfet de département interdit, dans les zones qu'il définit, aux seules fins de lutter contre la propagation du virus, les déplacements de personnes hors de leur lieu de résidence entre 21 heures et 6 heures du matin à l'exception des déplacements pour les motifs suivants, en évitant tout regroupement de personnes :	nan	nan	nan	nan	nan	nan	nan	nan
nan	2° Aux laboratoires et unités de recherche ;	nan	nan	nan	nan	nan	nan	nan	nan
nan	IV. - Toute personne de onze ans ou plus, qui accède ou demeure à bord d'un navire ou d'un bateau à passagers porte un masque de protection répondant aux caractéristiques techniques fixées par l'arrêté conjoint des ministres chargés de la santé et du budget mentionné au K bis de l'article 278-0 bis du code général des impôts. Sans préjudice des sanctions pénales prévues à l'article L. 3136-1 du code de la santé publique, l'accès au navire ou au bateau est refusé à toute personne qui ne respecte pas cette obligation et la personne est reconduite à l'extérieur du navire ou du bateau concerné.Cette obligation s'applique dans les zones accessibles au public des gares maritimes et des espaces d'attente, pour lesquelles le transporteur ou l'exploitant des installations organise les modalités de circulation des personnes présentes ou souhaitant accéder à ces espaces.Cette obligation ne s'applique pas au passager qui reste dans son véhicule embarqué à bord du navire ou du bateau lorsqu'il y est autorisé.L'obligation du port du masque pesant sur le passager ne fait pas obstacle à ce qu'il lui soit demandé de le retirer pour la stricte nécessité du contrôle de son identité.	nan	nan	nan	nan	nan	nan	nan	nan
nan	ReplierChapitre 5 : Dispositions de contrôle des prix (Articles 16 à 17)Article 16I. - Les dispositions du présent article sont applicables à la vente des gels ou solutions hydro-alcooliques destinés à l'hygiène corporelle, quelle que soit leur dénomination commerciale.II. - Les prix de la vente au détail des produits mentionnés au I ne peuvent excéder :1° Pour les contenants correspondant à un volume inférieur ou égal à 50 ml, 35,17 euros par litre toutes taxes comprises, soit un prix unitaire par flacon de 50 ml maximum de 1,76 euro toutes taxes comprises ;2° Pour les contenants correspondant à un volume supérieur à 50 ml et inférieur ou égal à 100 ml, 26,38 euros toutes taxes comprises par litre, soit un prix unitaire maximum par flacon de 100 ml de 2,64 euros toutes taxes comprises ;3° Pour les contenants correspondant à un volume supérieur à 100 ml et inférieur ou égal à 300 ml, 14,68 euros toutes taxes comprises par litre, soit un prix unitaire maximum par flacon de 300 ml de 4,40 euros toutes taxes comprises ;4° Pour les contenants correspondant à un volume supérieur à 300 ml, 13,19 euros toutes taxes comprises par litre, soit un prix unitaire maximum par flacon d'un litre de 13,19 euros toutes taxes comprises.	nan	nan	nan	nan	nan	nan	nan	nan
nan	Dans les départements et territoires mentionnés à l'annexe 2, le préfet de département interdit, dans les zones qu'il définit, aux seules fins de lutter contre la propagation du virus, les déplacements de personnes hors de leur lieu de résidence au cours d'une plage horaire comprise entre 20 heures et 6 heures du matin, à l'exception des déplacements pour les motifs suivants, en évitant tout regroupement de personnes	nan	nan	nan	nan	nan	nan	nan	nan
nan	La mise en quarantaine des personnes mentionnées à l'article 1er est prononcée par arrêté conjoint du préfet de police de Paris et du préfet du Calvados après avis des directeurs généraux des agences régionales de santé d'Ile-de-France et de Normandie.	nan	nan	nan	nan	nan	nan	nan	nan
nan	L'état d'urgence sanitaire déclaré par le décret n° 2020-1257 du 14 octobre 2020 déclarant l'état d'urgence sanitaire est prorogé jusqu'au 16 février 2021 inclus.	nan	nan	nan	nan	nan	nan	nan	nan
nan	Dans tous les cas, l’élection régulière des conseillers municipaux et communautaires, des conseillers d’arrondissement, des conseillers de Paris et des conseillers métropolitains de Lyon élus dès le premier tour organisé le 15 mars 2020 reste acquise, conformément à l’article 3 de la Constitution. II. – Au plus tard le 23 mai 2020, est remis au Parlement un rapport du Gouvernement fondé sur une analyse du comité de scientifiques se prononçant sur l’état de l’épidémie de covid-19 et sur les risques sanitaires attachés à la tenue du second tour et de la campagne électorale le précédant.	nan	nan	nan	nan	nan	nan	nan	nan
nan	3° Etablissements de type OA : Restaurants d'altitude ;	nan	nan	nan	nan	nan	nan	nan	nan
nan	I. - Le préfet de département est habilité, si l'afflux de patients ou de victimes ou la situation sanitaire le justifie, à ordonner, par des mesures générales ou individuelles, la réquisition nécessaire de tout établissement de santé ou établissement médico-social ainsi que de tout bien, service ou personne nécessaire au fonctionnement de ces établissements, notamment des professionnels de santé.	nan	nan	nan	nan	nan	nan	nan	nan
nan	2° Les établissements mentionnés au livre II du code de la route peuvent accueillir des candidats pour les besoins de la préparation aux épreuves du permis de conduire, lorsque ces établissements ne peuvent assurer cette préparation à distance ;	nan	nan	nan	nan	nan	nan	nan	nan
nan	La ministre de la transition écologique et solidaire, le ministre des solidarités et de la santé, le ministre de l'économie et des finances et la ministre des outre-mer sont chargés, chacun en ce qui le concerne, de l'exécution du présent décret, qui sera publié au Journal officiel de la République française et entrera en vigueur immédiatement.	nan	nan	nan	nan	nan	nan	nan	nan
nan	En cas de comparution immédiate :1° Le délai de trois jours ouvrables prévu par le troisième alinéa de l'article 396 du code de procédure pénale est porté à six jours ;2° Le délai maximal de six semaines prévu par le premier alinéa de l'article 397-1 du code de procédure pénale et le délai maximal de quatre mois prévu par le deuxième alinéa du même article sont respectivement portés à dix semaines et à six mois ;3° Le délai de deux mois prévu par le troisième alinéa de l'article 397-3 du code de procédure pénale et le délai de quatre mois prévu par le dernier alinéa du même article sont respectivement portés à quatre et six mois ;4° Le délai de quatre mois prévu au deuxième alinéa de l'article 397-4 du code de procédure pénale est porté à six mois.En cas de comparution à délai différé, le délai de deux mois prévu par le troisième alinéa de l'article 397-1-1 du code de procédure pénale est porté à quatre mois.	nan	nan	nan	nan	nan	nan	nan	nan
nan	La marine nationale a également contribué aux évacuations, le porte-hélicoptères amphibie (PHA) « Tonnerre » ayant transféré 12 patients d’Ajaccio à Marseille, afin de soulager le service de réanimation de l’hôpital d’Ajaccio, dont 13 des 15 lits étaient occupés.	nan	nan	nan	nan	nan	nan	nan	nan
nan	3° Au premier alinéa de l'article 9, la date : « 29 mars 2020 » est remplacée par la date : « 15 avril 2020 » ;	nan	nan	nan	nan	nan	nan	nan	nan
nan	S'agissant des vols mentionnés au II, qu'il s'engage à respecter un isolement prophylactique de sept jours après son arrivée en France métropolitaine, dans l'une des collectivités de l'article 73 de la Constitution, à Saint-Martin, Saint-Barthélemy et Saint-Pierre-et-Miquelon et, s'il est âgé de onze ans ou plus, à réaliser, au terme de cette période, un examen biologique de dépistage virologique permettant la détection du SARS-CoV-2. L'obligation mentionnée au présent 4° ne s'applique pas aux personnes arrivant sur le territoire métropolitain en provenance d'un pays de l'Union européenne, d'Andorre, d'Islande, du Liechtenstein, de Monaco, de Norvège, de Saint-Marin, du Saint-Siège ou de Suisse.	nan	nan	nan	nan	nan	nan	nan	nan
nan	IV. - Sont interdits, sauf s'ils sont fondés sur un motif impérieux d'ordre personnel ou familial, un motif de santé relevant de l'urgence ou un motif professionnel ne pouvant être différé, les déplacements de personnes par transport public aérien :1° Au départ du territoire continental de la France à destination de l'une des collectivités mentionnées à l'article 72-3 de la Constitution ou de la collectivité de Corse ;2° Au départ de l'une de ces collectivités à destination du territoire continental de la France ;3° Entre ces collectivités.	nan	nan	nan	nan	nan	nan	nan	nan
nan	Les données d'identification des personnes infectées ne peuvent être communiquées, sauf accord exprès, aux personnes ayant été en contact avec elles.Sont exclus de ces finalités le développement ou le déploiement d'une application informatique à destination du public et disponible sur équipement mobile permettant d'informer les personnes du fait qu'elles ont été à proximité de personnes diagnostiquées positives au covid-19.	nan	nan	nan	nan	nan	nan	nan	nan
nan	« Les conditions d'application du présent II sont fixées par le décret prévu au premier alinéa du I, en fonction de la nature et des modes de propagation du virus, après avis du comité de scientifiques mentionné à l'article L. 3131-19. Ce décret précise également les conditions dans lesquelles sont assurés l'information régulière de la personne qui fait l'objet de ces mesures, la poursuite de la vie familiale, la prise en compte de la situation des mineurs, le suivi médical qui accompagne ces mesures et les caractéristiques des lieux d'hébergement. » ;	nan	nan	nan	nan	nan	nan	nan	nan
nan	Article 9I. - L'accès du public aux parcs, jardins et autres espaces verts aménagés dans les zones urbaines est interdit dans les territoires classés en zone rouge. Dans les autres territoires, les parcs et jardins sont ouverts par l'autorité compétente dans des conditions de nature à permettre le respect et le contrôle des dispositions de l'article 1er et de l'article 7.	nan	nan	nan	nan	nan	nan	nan	nan
nan	I. - Tout rassemblement, réunion ou activité sur la voie publique ou dans un lieu ouvert au public est organisé dans des conditions de nature à permettre le respect des dispositions de l'article 1er.	nan	nan	nan	nan	nan	nan	nan	nan
nan	Les prix de la vente au détail des produits mentionnés au I ne peuvent excéder :1° Pour les contenants correspondant à un volume inférieur ou égal à 50 ml, 40 euros par litre toutes taxes comprises, soit un prix unitaire par flacon de 50 ml maximum de 2 euros toutes taxes comprises ;	nan	nan	nan	nan	nan	nan	nan	nan
nan	IV. - Pour les activités qui ne sont pas interdites en application du présent article, l'autorité compétente, respectivement pour les parcs, les jardins, les espaces verts aménagés dans les zones urbaines, les plages, les plans d'eau, les lacs, les centres d'activités nautiques, les ports de plaisance et les marchés informe les utilisateurs de ces lieux par affichage des mesures d'hygiène et de distanciation sociale, dites « barrières ».	nan	nan	nan	nan	nan	nan	nan	nan
nan	Le décret du 23 mars 2020 susvisé est ainsi modifié :1° Au premier alinéa de l'article 3, la date : « 31 mars 2020 » est remplacée par la date : « 15 avril 2020 » ;	nan	nan	nan	nan	nan	nan	nan	nan
nan	ReplierChapitre 8 : Dispositions funéraires (Article 25)Article 25Eu égard à la situation sanitaire :1° Les soins de conservation définis à l'article L. 2223-19-1 du code général des collectivités territoriales sont interdits sur le corps des défunts atteints ou probablement atteints du covid-19 au moment de leur décès ;2° Les défunts atteints ou probablement atteints du covid-19 au moment de leur décès font l'objet d'une mise en bière immédiate. La pratique de la toilette mortuaire est interdite pour ces défunts, à l'exclusion des soins réalisés post-mortem par des professionnels de santé ou des thanatopracteurs.Les soins et la toilette qui ne sont pas interdits par le présent article sont pratiqués dans des conditions sanitaires appropriées.	nan	nan	nan	nan	nan	nan	nan	nan
nan	Les personnes de onze ans ou plus souhaitant se déplacer par transport maritime à destination du territoire métropolitain depuis un pays étranger mentionné sur la liste figurant en annexe 2 bis présentent à l'embarquement le résultat d'un examen biologique de dépistage virologique réalisé moins de 72 heures avant la traversée ne concluant pas à une contamination par le covid-19.	nan	nan	nan	nan	nan	nan	nan	nan
nan	2° Etablissements de type CTS : Chapiteaux, tentes et structures ;	nan	nan	nan	nan	nan	nan	nan	nan
nan	Les mesures prises en application du présent chapitre peuvent faire l'objet, devant le juge administratif, des recours présentés, instruits et jugés selon les procédures prévues aux articles L. 521-1 et L. 521-2 du code de justice administrative.	nan	nan	nan	nan	nan	nan	nan	nan
nan	Des centres d'hébergement destinés à maintenir en quarantaine les personnes ayant résidé à Wuhan (Chine) et arrivant sur le territoire français sont ouverts dans le département du Calvados.	nan	nan	nan	nan	nan	nan	nan	nan
nan	IV. - L'accueil des usagers dans les établissements d'enseignement supérieur mentionnés au livre VII du code de l'éducation est autorisé aux seules fins de permettre l'accès aux services universitaires et interuniversitaires de médecine préventive et de promotion de la santé mentionnés à l'article D. 714-20 du code de l'éducation.	nan	nan	nan	nan	nan	nan	nan	nan
nan	b) Adaptant, interrompant, suspendant ou reportant le terme des délais prévus à peine de nullité, caducité, forclusion, prescription, inopposabilité, déchéance d’un droit, fin d’un agrément ou d’une autorisation ou cessation d’une mesure, à l’exception des mesures privatives de liberté et des sanctions. Ces mesures sont rendues applicables à compter du 12 mars 2020 et ne peuvent excéder de plus de trois mois la fin des mesures de police administrative prises par le Gouvernement pour ralentir la propagation de l’épidémie de covid-19 ;	nan	nan	nan	nan	nan	nan	nan	nan
nan	L'accueil des usagers dans les établissements d'enseignement supérieur mentionnés au livre VII de la troisième partie du code de l'éducation et dans les autres organismes de formation militaire supérieure est autorisé aux seules fins de permettre l'accès :1° Aux formations continues ou dispensées en alternance ;2° Aux laboratoires et unités de recherche ;3° Aux bibliothèques et centres de documentation ;4° Aux services administratifs, notamment ceux chargés des inscriptions, uniquement sur rendez-vous ou sur convocation de l'établissement ;5° Aux services de médecine préventive et de promotion de la santé ;6° Aux centres hospitaliers universitaires vétérinaires ;7° Aux exploitations agricoles mentionnées à l'article L. 812-1 du code rural et de la pêche maritime ;8° Aux locaux donnant accès à des équipements informatiques, uniquement sur rendez-vous ou sur convocation de l'établissement.	nan	nan	nan	nan	nan	nan	nan	nan
nan	Les établissements relevant des types d'établissements définis par le règlement pris en application de l'article R. 123-12 du code de la construction et de l'habitation peuvent accueillir du public, dans des conditions de nature à permettre le respect des dispositions de l'article 1er, pour :	nan	nan	nan	nan	nan	nan	nan	nan
nan	« II.-Le représentant de l'Etat dans le département peut procéder à la réquisition des matières premières nécessaires à la fabrication des catégories de masques mentionnées à l'article 12.	nan	nan	nan	nan	nan	nan	nan	nan
nan	6. Ces dispositions sont conformes à la Constitution.Le Conseil constitutionnel décide :	nan	nan	nan	nan	nan	nan	nan	nan
nan	La violation des autres interdictions ou obligations édictées en application des articles L. 3131-1 et L. 3131-15 à L. 3131-17 est punie de l'amende prévue pour les contraventions de la quatrième classe. Cette contravention peut faire l'objet de la procédure de l'amende forfaitaire prévue à l'article 529 du code de procédure pénale. Si cette violation est constatée à nouveau dans un délai de quinze jours, l'amende est celle prévue pour les contraventions de la cinquième classe.	nan	nan	nan	nan	nan	nan	nan	nan
nan	- établissements de type X : Etablissements sportifs couverts ;	nan	nan	nan	nan	nan	nan	nan	nan
nan	Cette disposition ne s’applique pas aux personnes intervenant dans le cadre de missions de service public, y compris à titre bénévole, ou dans le cadre de réquisitions, d’assistance à des individus nécessitant des soins, d’approvisionnement des commerces ou pour les déplacements liés à l’activité professionnelle (sur présentation d’une attestation de l’employeur) ainsi qu’aux personnes dont les déplacements sont liés à des nécessités impérieuses familiales ou médicales	nan	nan	nan	nan	nan	nan	nan	nan
nan	Les personnes de onze ans ou plus se déplaçant par transport terrestre à destination de la Guyane en provenance du Brésil présentent, à l'entrée sur le territoire, le résultat d'un test ou d'un examen biologique de dépistage virologique réalisé moins de 72 heures avant leur déplacement ne concluant pas à une contamination par le covid-19. Les seuls tests antigéniques pouvant être valablement présentés pour l'application du présent article sont ceux permettant la détection de la protéine N du SARS-CoV-2.	nan	nan	nan	nan	nan	nan	nan	nan
nan	Placée sous la tutelle du SGDSN, l’Agence nationale de sécurité des systèmes d’information a contribué à la protection des opérateurs d’importance vitale, au premier rang desquels les centres hospitaliers universitaires (CHU), ainsi qu’à celle de la population, davantage exposée à des actes de cybercriminalité en raison, notamment, de la généralisation du télétravail. Son directeur général, Guillaume Poupard, devant la Commission, a plaidé pour que la France se donne les moyens de maintenir sa souveraineté numérique, estimant que les efforts en matière de souveraineté nationale devaient se combiner avec le développement d’une véritable autonomie stratégique européenne dans le domaine cyber.	nan	nan	nan	nan	nan	nan	nan	nan
nan	Article 1er: l'article 1Er de l'arrêté n°26-2020-03-31-008 est mofifié de la façon suivant Les mesures du présent arrêté s'appliquent jusqu'au 11 mai 2020	nan	nan	nan	nan	nan	nan	nan	nan
nan	Le préfet de département peut, lorsque l'évolution de la situation sanitaire le justifie et aux seules fins de lutter contre la propagation du virus, prendre les mesures définies par les dispositions suivantes :	nan	nan	nan	nan	nan	nan	nan	nan
nan	Par dérogation aux dispositions de l'article 712-5 du code de procédure pénale, les réductions de peine, les autorisations de sorties sous escortes et les permissions de sortir peuvent être ordonnées sans que soit consultée la commission de l'application des peines, lorsque le procureur de la République émet un avis favorable sur la mesure. A défaut, le juge de l'application des peines statue, après avoir recueilli les avis écrits des membres de la commission d'application des peines, par tout moyen.	nan	nan	nan	nan	nan	nan	nan	nan
nan	Les prix de la vente au détail des produits mentionnés au I ne peuvent excéder :1° Pour les contenants correspondant à un volume inférieur ou égal à 50 ml, 35,17 euros par litre toutes taxes comprises, soit un prix unitaire par flacon de 50 ml maximum de 1,76 euro toutes taxes comprises ;	nan	nan	nan	nan	nan	nan	nan	nan
nan	I. - Sauf dérogation accordée par le préfet de département, ou par le préfet maritime au-delà des limites administratives des ports et en aval de la limite transversale de la mer, il est interdit à tout navire de croisière de faire escale, de s'arrêter ou de mouiller dans les eaux intérieures et la mer territoriale françaises.	nan	nan	nan	nan	nan	nan	nan	nan
nan	2° Déplacements pour effectuer des achats de fournitures nécessaires à l'activité professionnelle et des achats de première nécessité dans des établissements dont les activités demeurent autorisées par l'article 8 du présent décret ;	nan	nan	nan	nan	nan	nan	nan	nan
nan	II.-Les prix de vente au détail des produits mentionnés au I ne peuvent excéder :1° Pour les contenants correspondant à un volume inférieur ou égal à 50 ml, 35,17 euros par litre toutes taxes comprises, soit un prix unitaire par flacon de 50 ml maximum de 1,76 euro toutes taxes comprises ;	nan	nan	nan	nan	nan	nan	nan	nan
nan	Les établissements relevant des catégories mentionnées par le règlement pris en application de l'article R. 123-12 du code de la construction et de l'habitation figurant ci-après ne peuvent accueillir du public :1° Etablissements de type L : Salles d'auditions, de conférences, de réunions, de spectacles ou à usage multiple, sauf pour :	nan	nan	nan	nan	nan	nan	nan	nan
nan	Une rangée sur deux est laissée inoccupée.	nan	nan	nan	nan	nan	nan	nan	nan
nan	Toute personne souhaitant se déplacer à destination de la Corse en provenance du territoire hexagonal présente à l'entreprise de transport, avant son embarquement :2° Si elle est âgée de onze ans ou plus, le résultat d'un examen biologique de dépistage virologique réalisé moins de 72 heures avant le voyage ne concluant pas à une contamination par le covid-19. Par dérogation, cette obligation ne s'applique pas aux professionnels du transport routier dans l'exercice de leur activité.	nan	nan	nan	nan	nan	nan	nan	nan
nan	Article 3Une permanence des services d'assistance en escale est assurée.	nan	nan	nan	nan	nan	nan	nan	nan
nan	La présente loi entrera en vigueur immédiatement et sera exécutée comme loi de l’Etat. Fait à Paris, le 23 mars 2020.	nan	nan	nan	nan	nan	nan	nan	nan
nan	au titre de la catégorie N : Restaurants et débits de boissons	nan	nan	nan	nan	nan	nan	nan	nan
nan	4° Les enfants scolarisés et ceux bénéficiant d'un mode d'accueil en application de l'article L. 227-4 du code de l'action sociale et des familles peuvent également pratiquer des activités physiques et sportives, à l'exception de celles mentionnées aux a, b et c du 1°, au sein des équipements sportifs des établissements relevant du type X défini par le règlement pris en application de l'article R. 123-12 du code de la construction et de l'habitation. La limite de dix personnes fixées au 1° ne s'applique pas à ces activités ;	nan	nan	nan	nan	nan	nan	nan	nan
nan	5. Afin de faire face aux conséquences de l'épidémie du virus covid-19 sur le fonctionnement des juridictions, l'article unique de cette loi organique se borne à suspendre jusqu'au 30 juin 2020 le délai dans lequel le Conseil d'Etat ou la Cour de cassation doit se prononcer sur le renvoi d'une question prioritaire de constitutionnalité au Conseil constitutionnel et celui dans lequel ce dernier doit statuer sur une telle question. Il ne remet pas en cause l'exercice de ce recours ni n'interdit qu'il soit statué sur une question prioritaire de constitutionnalité durant cette période.	nan	nan	nan	nan	nan	nan	nan	nan
nan	Toute personne de onze ans ou plus porte un masque de protection dans les établissements de type L, X, PA, CTS, V, Y, S, M, T et, à l'exception des bureaux, W, ainsi que, s'agissant de leurs espaces permettant des regroupements, dans les établissements de type O, sans préjudice des autres obligations de port du masque fixées par le présent décret. Il peut être rendu obligatoire par l'exploitant dans les autres types d'établissements.	nan	nan	nan	nan	nan	nan	nan	nan
nan	II. - L'exploitant d'aéroport et le transporteur aérien informent les passagers par un affichage en aérogare, une information à bord des aéronefs et par des annonces sonores des mesures d'hygiène et de distanciation sociale, dites « barrières ».	nan	nan	nan	nan	nan	nan	nan	nan
nan	III. - Les personnes qui se déplacent pour l'un des motifs prévus au I se munissent, lors de leurs déplacements, d'une déclaration indiquant le motif du déplacement accompagnée, le cas échéant, d'un ou plusieurs documents justifiant ce motif ainsi que d'un justificatif du lieu de résidence. Le modèle de cette déclaration est fixé par arrêté du ministre de l'intérieur.	nan	nan	nan	nan	nan	nan	nan	nan
nan	Article 13[Dispositions déclarées non conformes à la Constitution par la décision du Conseil constitutionnel n° 2020-800 DC du 11 mai 2020.]La présente loi entrera en vigueur immédiatement et sera exécutée comme loi de l'Etat.	nan	nan	nan	nan	nan	nan	nan	nan
nan	- au titre de la catégorie Y : Musées.	nan	nan	nan	nan	nan	nan	nan	nan
