id	text	event1	event2	event3	event4	event5	event6	event7	event8
nan	8a. In the event of announcing an epidemic emergency or an epidemic, a trainee doctor may be directed by: 1) a voivode to work on combating an epidemic pursuant to Article 47 of the Act on 5 December 2008. on the prevention and combating of infections and infectious diseases (Journal of Laws of 2019, items 1239 and 1495 and of 2020, items 284, 322 and 374) to the entity in which they are interning, or to another entity	nan	nan	nan	nan	nan	nan	nan	nan
nan	hall read as follows: 3) persons diagnosed with a disease caused by SARS virus - CoV-2 (COVID-19) or suspected disease, unless they have been referred by a doctor for treatment or laboratory diagnosis of SARS-CoV-2 virus as part of isolation carried out outside the hospital, including isolation in home conditions. 	nan	nan	nan	nan	nan	nan	nan	nan
nan	point 4, consist in the obligation to ensure that during the exercise of religious worship, including religious activities or rituals, in a given area or in a given facility there are jointly, both inside and outside the premises, not more than 5 participants, except for religious worshipers people employed by the funeral director in the event of a funeral - the period from 25 March 2020. until April 11, 2020	nan	nan	nan	nan	nan	nan	nan	nan
nan	§1.1. In the period from March 26, 2020. until April 10, 2020 in the territory of the country, the functioning of universities supervised by the minister responsible for maritime economy is limited by: 1) suspension of lectures and other didactic classes organized by the Maritime University in Szczecin and Gdynia Maritime University in the territory of the Republic of Poland; in their area, except in cases where it is necessary to ensure the continuity of the functioning of these universities.	nan	nan	nan	nan	nan	nan	nan	nan
nan	in §3 point 2 is replaced by the following: 2) in the case of schools providing vocational training - the suspension also applies to classes carried out within the framework of practical vocational training organized by the school and student internship, referred to in Art. 121a of the Act of December 14, 2016. –Education law; ”;	nan	nan	nan	nan	nan	nan	nan	nan
nan	§1 In the Regulation of the Minister of Interior and Administration of April 10, 2020 on the temporary limitation of the functioning of higher education institutions of state services (Journal of Laws item 654) in §1: 1) in the introduction to the enumeration of the words April 26, 2020 shall be replaced by the words May 24, 2020;	nan	nan	nan	nan	nan	nan	nan	nan
nan	REGULATION OF THE MINISTER OF INTERNAL AFFAIRS AND ADMINISTRATION of 28 April 2020 amending the regulation on temporarily reintroducing border control of persons crossing the state border constituting an internal border	nan	nan	nan	nan	nan	nan	nan	nan
nan	In the event of persistent circumstances causing the change of dates, the minister responsible for health shall change these dates again, however, the total period of postponing a given date may not be longer than 5 months.	nan	nan	nan	nan	nan	nan	nan	nan
nan	4. A person is required to uncover his mouth and nose at the request of: 1) authorized bodies in the case of identifying this person in order to establish his identity; 2) another person in connection with the provision of services or the performance of professional or official activities, including in the case of the need to identify or verify identity of the person.	nan	nan	nan	nan	nan	nan	nan	nan
nan	2) duties of a doctor or a medical assistant in the case of suspicion or diagnosis of an infection or an infectious disease resulting in the obligation to isolate or isolate at home;	nan	nan	nan	nan	nan	nan	nan	nan
nan	2) duties of a doctor or a medical assistant in the case of suspicion or diagnosis of an infection or an infectious disease resulting in the obligation to hospitalize	nan	nan	nan	nan	nan	nan	nan	nan
nan	Period from March 26, 2020. until April 10, 2020 the university referred to in section 1, which has the infrastructure and software to conduct classes with the use of distance learning methods and techniques, conducts classes using these methods and techniques, regardless of whether it has been provided for in the curriculum of a given education.	nan	nan	nan	nan	nan	nan	nan	nan
nan	Article 48a. 1. Whoever, in an epidemic threat or state of an epidemic, does not comply with the orders, bans or limitations established on the basis of Article 46 or Article 46b, referred to in: 4) Article 46 (4) (6), shall be subject to a financial penalty in the amount from PLN 5,000 to PLN 10,000;	nan	nan	nan	nan	nan	nan	nan	nan
nan	2. Whoever in a state of epidemic threat or state of epidemic fails to implement the decisions referred to in Article 47 section 4 shall be subject to a financial penalty in the amount of PLN 5,000 to PLN 30,000.	nan	nan	nan	nan	nan	nan	nan	nan
nan	2. During the period of suspension of education, activities related to the awarding of scientific degrees and titles may be suspended, if it is not possible to pass resolutions by secret ballot.	nan	nan	nan	nan	nan	nan	nan	nan
nan	The information about the change of these terms is announced by the minister competent for health on his website.	nan	nan	nan	nan	nan	nan	nan	nan
nan	2) in §3, paragraph 1, point b shall read as follows: b) item 3, to the indicated hospital and immediately informs the hospital of this fact, unless, after assessing the clinical condition of that person, he / she is referred for SARS virus treatment or laboratory diagnosis - CoV-2 within isolation provided outside the hospital, including isolation in home conditions; ”	nan	nan	nan	nan	nan	nan	nan	nan
nan	1c. In the event of the announcement of an epidemic threat or an epidemic, the minister competent for health may change the dates referred to in paragraph 1a.	nan	nan	nan	nan	nan	nan	nan	nan
nan	In cases justified by extraordinary circumstances, in particular threats to the life or health of people participating in the PESDL, the minister competent for health may revoke all or part of the PESDL in a given field.	nan	nan	nan	nan	nan	nan	nan	nan
nan	If the circumstances causing the change of dates persist, the minister responsible for health shall change these dates again, however, the total period of postponing a given date may not exceed 5 months.	nan	nan	nan	nan	nan	nan	nan	nan
nan	the following changes are made: 1) in §2: a) after section 1, section 1a shall be added with the wording: 1a. Border control of persons, temporarily restored for the period referred to in section 1, shall be extended for the period from 25 March 2020 . until April 13, 2020 	nan	nan	nan	nan	nan	nan	nan	nan
nan	Article 48a. 1. Who in the state of epidemic threat or state of epidemic does not adhere to the orders, prohibitions or restrictions established on the basis of Article 46 or Article 46b, which are referred to in: art. 46 (4) (1) or Article 46b (5) and 9-12, shall be subject to a financial penalty in the amount from PLN 5,000 to PLN 30,000	nan	nan	nan	nan	nan	nan	nan	nan
nan	The minister competent for health may, by means of a regulation, impose on manufacturers, authorized representatives, distributors and importers of medical devices, producers and importers of foodstuffs for particular nutritional uses or entities responsible for biocidal products, holders of a parallel trade permit or permit and manufacturers of biocidal products	nan	nan	nan	nan	nan	nan	nan	nan
nan	REGULATION OF THE MINISTER OF INTERNAL AFFAIRS AND ADMINISTRATION of April 9, 2020 amending the regulation on the temporary reintroduction of border control of persons crossing the state border constituting an internal border	nan	nan	nan	nan	nan	nan	nan	nan
nan	3. In the case of conducting classes in the manner specified in section 2, the verification of the achieved learning outcomes specified in the curriculum of a given education may take place outside the seat of the university, with the use of IT technologies ensuring control of the verification of the achieved learning outcomes and its registration.	nan	nan	nan	nan	nan	nan	nan	nan
nan	Article 48a. 1. Whoever in an epidemic threat or state of an epidemic shall not adhere to the orders, bans or limitations established on the basis of Article 46 or Article 46b, which are referred to in Article 46 section 4 points 3-5 or value 46b point 2 and 8, shall be subject to a financial penalty in the amount from PLN 10,000 to PLN 30,000;	nan	nan	nan	nan	nan	nan	nan	nan
nan	1) after sec. 1b, the following paragraph shall be added: 1c as follows:1c. Border control of persons, temporarily reintroduced for the period referred to in sec. 1-1b, extends tothe period from 4 May 2020 to 13 May 2020 ';	nan	nan	nan	nan	nan	nan	nan	nan
nan	point 4, consist in the obligation to ensure that during the exercise of religious worship, including religious activities or rituals, in a given area or in a given facility there are a total of no more than: a) 50 people, including participants and persons worshipers or persons employed by a funeral director in the event of a funeral - at the time of 20 March 2020. until March 24, 2020 and in the period from April 12, 2020. until further notice	nan	nan	nan	nan	nan	nan	nan	nan
nan	REGULATION OF THE MINISTER OF NATIONAL EDUCATION of April 24, 2020. amending the regulation on the temporary limitation of the functioning of education system units in connection with the prevention, counteracting and combating COVID-19	nan	nan	nan	nan	nan	nan	nan	nan
nan	Article 48a. 1. Who in the state of epidemic threat or state of epidemic does not comply with  the orders, bans or limitations established on the basis of article 46 or article 46b, which are referred to in 5) art. 46 section 4 point 7 or value 46b point 4, shall be subject to a financial penalty in the amount from PLN 5,000 to PLN 10,000	nan	nan	nan	nan	nan	nan	nan	nan
nan	1. The regulation specifies: 1) infectious diseases causing the obligation to hospitalize	nan	nan	nan	nan	nan	nan	nan	nan
nan	2. During the period referred to in sec. 1, the Academy's research institutes which have the infrastructure and software at their disposal to conduct classes with the use of distance learning methods and techniques, conduct classesusing these methods and techniques, whether or not it is foreseen in the curriculum of the given education.	nan	nan	nan	nan	nan	nan	nan	nan
nan	§ 1. In the regulation of the Minister of Culture and National Heritage of April 9, 2020 on temporaryrestrictions on the functioning of art universities in connection with the prevention, counteraction and combating COVID-19(Journal of Laws item 641) in § 1:1) in sec. 1 in the introduction to the enumeration, the words April 26, 2020 shall be replaced by the words 24 May 2020;	nan	nan	nan	nan	nan	nan	nan	nan
nan	§3a.1. In the period from March 25, 2020. until April 11, 2020 the movement of persons staying in this area is prohibited in the territory of the Republic of Poland, except for the movement of a given person for the purpose of	nan	nan	nan	nan	nan	nan	nan	nan
nan	2. When the movement takes place: 1) on foot - two people may move at the same time, not less than 1.5 m from each other;	nan	nan	nan	nan	nan	nan	nan	nan
nan	REGULATION OF THE MINISTER OF HEALTH of March 31, 2020 amending the regulation on the declaration of an epidemic in the territory of the Republic of Poland	nan	nan	nan	nan	nan	nan	nan	nan
nan	§1.Wprowadza  się  zakaz  wykonywania,  na  lotniskach  wpisanych  do  rejestru  lotnisk  cywilnych  ilądowiskachwpisanych do ewidencji lądowisk, lądowania przewożących pasażerów cywilnych statków powietrznych wykonujących loty międzynarodow	nan	nan	nan	nan	nan	nan	nan	nan
nan	3) auxiliary research units of the Academy by limiting the obligation to perform work by employeesthese units within their area	nan	nan	nan	nan	nan	nan	nan	nan
nan	1)po ust.1a dodaje się ust.1b wbrzmieniu:„1b.Kontrolę graniczną osób, przywróconą tymczasowo na okres, októrym mowa wust.1  i1a, przedłuża się na okres od dnia 14kwietnia 2020r. do dnia 3maja 2020r.”;	nan	nan	nan	nan	nan	nan	nan	nan
nan	6a. In the event of announcing an epidemic threat or state of an epidemic, the minister competent for health may change the dates referred to in paragraph 6.	nan	nan	nan	nan	nan	nan	nan	nan
nan	§2.1. Compulsory hospitalization covers: infected or sick persons, as well as suspected infection or illness	nan	nan	nan	nan	nan	nan	nan	nan
nan	1. The regulation specifies: 1) infectious diseases causing the obligation to isolate or isolate in domestic conditions	nan	nan	nan	nan	nan	nan	nan	nan
nan	REGULATION OF THE MINISTER OF MARITIME ECONOMY AND INLAND NAVIGATION of 23 March 2020 on the temporary limitation of the functioning of maritime universities in the territory of the Republic of Poland due to the prevention of SARS-CoV-2 virus infection	nan	nan	nan	nan	nan	nan	nan	nan
nan	2. During the period of suspension of education, classes may be carried out with the use of distance learning methods and techniques, regardless of whether it was provided for in the curriculum of this education.	nan	nan	nan	nan	nan	nan	nan	nan
nan	2) in §11b, the current content is marked as para. 1 and paragraph is added. 2-9 in the wording: 2.The recruitment procedure for the school year 2020/2021 to grades I of public secondary schools and entrance classes, referred to in Art. 25 sec. 3 of the Act of December 14, 2016. - Educational law, with the exception of public post-secondary schools, public sectoral secondary schools and public schools for adults, is carried out on new dates specified by the minister responsible for education. The new deadlines for the recruitment procedure as well as the deadlines for submitting documents are made public on the website of the office supporting the minister responsible for education.	nan	nan	nan	nan	nan	nan	nan	nan
nan	§2.1. Compulsory hospitalization covers: 1) people suffering from tuberculosis during the mycobacterial period and people with justified suspicion of tuberculosis;	nan	nan	nan	nan	nan	nan	nan	nan
nan	the following changes are introduced: 1) in §2: b) in section 2 shall read as follows: 2. The scope of control referred to in sections 1 and 1a, including the possibility of limiting it on the terms specified in the Schengen Border Code, will be adjusted to the degree of threat public order or state security in relation to the occurrence of a serious threat to public health caused by the SARS-CoV-2 coronavirus, causing the COVID-19 disease. 	nan	nan	nan	nan	nan	nan	nan	nan
nan	Article 48a. 1. Whoever in an epidemic threat or state of an epidemic shall not adhere to the orders, bans or limitations established on the basis of Article 46 or Article 46b, which are referred to in: Article 46 section 4 point 2 or value 46b point 3, shall be subject to a financial penalty in the amount from PLN 10,000 to PLN 30,000	nan	nan	nan	nan	nan	nan	nan	nan
nan	Article 25b. In the event of a declaration of an epidemic threat, state of an epidemic or the risk of spreading an infection or an infectious disease that may pose a threat to public health, in particular the occurrence of a particularly dangerous or highly infectious disease, the director of the Institute may postpone the date of the inspection referred to in Art. 25a section 1, once, not longer than for a period of 6 months from the date of lapse of 2 years from the date of the last inspection.	nan	nan	nan	nan	nan	nan	nan	nan
nan	In cases justified by extraordinary circumstances, in particular threatening the life or health of persons qualified to commence specialization training, the minister competent for health may extend the time for commencement of specialization training for a period not longer than 6 months.	nan	nan	nan	nan	nan	nan	nan	nan
nan	2. Obligatory isolation or isolation in domestic conditions shall apply to persons who have been diagnosed with SARS-CoV-2 virus infection or contracted disease caused by SARS-CoV-2 (COVID-19) virus, or suspected infection or disease	nan	nan	nan	nan	nan	nan	nan	nan
nan	Financial penalties referred to in paragraph 2, measures respectively the Governor or the relevant minister of health.	nan	nan	nan	nan	nan	nan	nan	nan
nan	REGULATION OF THE MINISTER OF SCIENCE AND HIGHER EDUCATION of 27 April 2020 on the temporary limitation of the functioning of corporations of scientists and scientific units of the Polish Academy of Sciences in connection with the prevention, prevention and combating of COVID-19	nan	nan	nan	nan	nan	nan	nan	nan
nan	§2.Wprowadza  się  zakaz  wykonywania,  na  lotniskach  wpisanych  do  rejestru  lotnisk  cywilnych  ilądowiskachwpisanych do ewidencji lądowisk, lądowania handlowego przez statki powietrzne wykonujące loty  wruchu  krajowym	nan	nan	nan	nan	nan	nan	nan	nan
nan	The information about the change of these terms is announced by the minister competent for health on his website.	nan	nan	nan	nan	nan	nan	nan	nan
nan	amending the regulation on the temporary limitation of the functioning of certain entities of the higher education system and science in connection with the prevention, counteracting and combating COVID-19	nan	nan	nan	nan	nan	nan	nan	nan
nan	§18.1. From April 16, 2020, until further notice, the obligation to cover the mouth and nose with clothing or its parts, mask or mask,	nan	nan	nan	nan	nan	nan	nan	nan
nan	in §1, section 5 is added with the following wording: 5. In the period referred to in section 1, the colleges of electors of public universities, scholarship commissions, commissions and teams appointed in proceedings for awarding degrees and titles conducted at universities, as well as committees and other bodies operating on the basis of university statutes, adopt resolutions for by means of electronic communication, regardless of whether such a mode of their taking was defined in internal regulations of universities or in acts regulating the operation of these entities. ”.	nan	nan	nan	nan	nan	nan	nan	nan
nan	In the event of announcing an epidemic threat or an epidemic, the minister competent for health may change the dates referred to in section 4.	nan	nan	nan	nan	nan	nan	nan	nan
nan	3. The financial penalties referred to in 1) para. 1, measures, by administrative decision, the state district sanitary inspector and the state border sanitary inspector;	nan	nan	nan	nan	nan	nan	nan	nan
nan	2) paragraph 3 is replaced by the following:3. In the case of conducting classes in the manner specified in para. 2 verification of the achieved learning outcomes specified in the curriculum of a given education, in particular conducting credits and examinations at the end of specific classes and diploma examinations, may take place outside the headquarters of an art university or outside its branch, with the use of information technologies ensuring control of the verification of the achieved learning outcomes, and its registration. ”.	nan	nan	nan	nan	nan	nan	nan	nan
nan	2. In the event that the movement takes place: 2) by means of public collective transport, within the meaning of Article 1a (4) (3a) of the Act of June 20, 1992, entitlement to concessionary journeys by means of public collective transport (Journal of Laws of 2018, item 295) - this means may be used to transport , at the same time, no more than half the seated	nan	nan	nan	nan	nan	nan	nan	nan
nan	2) sec. 3 shall read as follows: 3. In the case of conducting classes in the manner specified in clause 2, verification of the achieved learning outcomes specified in the curriculum of a given education, in particular conducting credits and examinations at the end of specific classes and diploma examinations, may take place outside the seat of the university, with the use of IT technologies ensuring control of the verification of learning outcomes and its registration.	nan	nan	nan	nan	nan	nan	nan	nan
nan	ACT of March 31, 2020 amending certain acts in the field of the health care system related to preventing, counteracting and combating COVID-19	nan	nan	nan	nan	nan	nan	nan	nan
nan	REGULATION OF THE MINISTER OF CULTURE AND NATIONAL HERITAGE of April 24, 2020. amending the regulation on the temporary limitation of the functioning of art universities in connection with the prevention, prevention and combating of COVID-19	nan	nan	nan	nan	nan	nan	nan	nan
nan	2) limitation of the obligation to perform work by employees of universities listed in paragraph 1 in their area, except in cases where it is necessary to ensure the continuity of the operation of these universities.	nan	nan	nan	nan	nan	nan	nan	nan
nan	2) the Academy's research institutes by: b) suspending education:- in postgraduate studies,- in other forms- carried out as part of the classes;	nan	nan	nan	nan	nan	nan	nan	nan
nan	2) paragraph 2 shall read as follows: 2. The scope of control referred to in sections 1–1b, including the possibility of limiting it on the principles set out in the Schengen Border Code, will be adapted to the degree of threat to public order or state	nan	nan	nan	nan	nan	nan	nan	nan
nan	§1.1 In the period from April 11, 2020 until April 26, 2020 the functioning of higher education institutions of state services supervised by the minister responsible for internal affairs is limited by the suspension of education: 1) during studies; 2) at postgraduate studies; 3) in other forms.	nan	nan	nan	nan	nan	nan	nan	nan
nan	REGULATION OF THE MINISTER OF HEALTH of March 24, 2020 amending the regulation on the declaration of an epidemic in the territory of the Republic of Poland	nan	nan	nan	nan	nan	nan	nan	nan
nan	3) after §4b, §4c is added to the wording: §4c. The provision of §3a also applies to charges of a youth educational center who have obtained leave consent in accordance with the provisions issued under Art. 81 of the Act of October 26, 1982. in the proceedings in juvenile cases (Journal of Laws of 2018, item 969) and they are not staying in the youth educational center. 	nan	nan	nan	nan	nan	nan	nan	nan
nan	By canceling PESDL, the minister responsible for health extends the duration of the examination session in which the canceled examination was to take place, once for a period not longer than 6 months.	nan	nan	nan	nan	nan	nan	nan	nan
nan	6) in chapter 5 after §11, §11a is added with the wording: “§11a.1. In the period from March 25, 2020. until April 11, 2020 it is forbidden to: other than specified in paragraph 1 assemblies organized as part of the activities of churches and other religious associations and events, meetings and meetings, regardless of their type, with the exception of meetings of a given person with persons closest to him within the meaning of Article 115 §11 of the Act of 6c zerwca 1997. - the Penal Code or with people closest to the person with whom he / she stays together.	nan	nan	nan	nan	nan	nan	nan	nan
nan	§1 In the Regulation of the Minister of National Education on March 11, 2020 on the temporary limitation of the functioning of education system units in connection with the prevention, counteraction and combating of COVID-19 (Journal of Laws, item 410,492,595 and 642), used in §2 in paragraphs 1 and 1a, in §3 in point 3, in §3 paragraph 1 and 3 and in §4 the words April 26, 2020.  shall be replaced by the words May 24, 2020	nan	nan	nan	nan	nan	nan	nan	nan
nan	2.From March 27, 2020 a person crossing the border of the Republic of Poland as part of performing professional activities in the Republic of Poland or in a neighboring country may receive, at his request, from the competent authority of the State Sanitary Inspection, a certificate of compulsory quarantine	nan	nan	nan	nan	nan	nan	nan	nan
